title,created_utc,subreddit
"Jon Jones shares back photo, claims to be 250lbs.",1610573731,MMA
"Kell Brook responding to Eubank jr, seemingly wants to fight him",1610651357,Boxing
[POST FIGHT THREAD] Ryan Garcia v Luke Campbell,1609632653,Boxing
A bit old but pretty factual,1609619247,Boxing
Average man vs Mike Tyson,1610591444,Boxing
Masvidal drops Diaz in the opening minute of their BMF title fight.,1609987303,MMA
Elite woman vs fit untrained man,1608923163,MMA
"Holyfield To Mike Tyson: No More Excuses, Sign The Contract - I'm Ready",1606852433,Boxing
Don King Productions Event Jan 29,1609952150,Boxing
Can't wait to listen to Sergio and Chris bickering like an old married couple!,1607807760,Boxing
How long from your first day boxing until you feel confident vs non boxers?,1610243851,Boxing
Anyway to watch the Dana Q&amp;A from yesterday?,1609953511,MMA
Pay the teachers,1608901281,MMA
Figueiredo makes weight. 124.5! https://t.co/IlxCmX97ta,1607706142,MMA
I have a question about jumping rope,1608812025,Boxing
It's a dilemma every time,1608904309,MMA
"Merry Christmas everyone!! We’re Doing another Trivia/Giveaway, Xmas edition at 6pm est come win some stuff. Come through",1608924300,MMA
Throwing Nothing but Heavy,1606522698,Boxing
"Kell Brook responding to Eubank jr, seemingly wants to fight him",1610651357,Boxing
i think im banned from r/boxing,1607296177,Boxing
Bellator officially announces Yoel Romero on their IG,1608059461,MMA
Canelo's mum furious because her son was robbed.,1608534178,Boxing
Mike Tyson 1980s vs 2020s Training Comparison 40 years later (Motivation),1606409426,Boxing
Must read this speech don't be invisible,1608820872,MMA
Watch!!LIVE!! DEADLIEST MATCH MIKE TYSON VS ROY JONES JR. https://t.me/tyson_vs_jones_live/11,1606604580,Boxing
Twisted Tea Boxing,1609292111,Boxing
Will the Spence vs Crawford fight happen in 2021 or is it too early?,1609201580,Boxing
Boxing advice for a beginner.,1608236829,Boxing
"Kayla Harrison Fight Off Titan FC 66 After Opponent Hospitalized, Overweight by 25lbs",1608232635,MMA
Canelo has a long way to go to be p4p,1608027742,Boxing
Eric Albaraccin reveals that Costa is preparing for Whittaker (in the Pitbull Bros Gym in Natal) Note: I've linked time stamp directly. 30s post time stamp he reveals that they're training for Robert Whittaker which I assume will be for an Interim Belt.,1610271557,MMA
Eddie Hearn has high hopes of putting together fights between Canelo Alvarez and Billy Joe Saunders and Gennady Golovkin and Demetrius Andrade,1610356313,Boxing
[Coppinger] Sources: Adrien Broner set to end two-year layoff vs. Pedro Campa in February,1610088106,Boxing
Glove wrapping help,1608482567,MMA
Henry Cejudo covers WAP with CAH - Cringe Ass Henry,1608322385,MMA
Kenshiro Teraji receives three-month suspension for drunk driving,1608158284,Boxing
Streams,1606407850,Boxing
Hasanboy Dusmatov TKO's Jesus Cervantes in his pro debut with a left hand head-body combination. He returns to the ring this Thursday on Match TV in Russia.,1608639497,Boxing
Former ATT Coach Din Thomas Ranks Dustin Poirier's Opponents: From Conor McGregor to Max Holloway,1610654356,MMA
Jason Thacker,1610238031,MMA
How likely is it to meet any famous MMA Stars in the gyms they train at?,1610114843,MMA
BREAKING: Raphael Assuncao will fight Raoni Barcelos at UFC event on February 27th,1608337114,MMA
Brad Riddell vs Gregor Gillespie in the works for February 13 (UFC 258),1607916918,MMA
The Brandon Moreno vs Figueiredo scorecard was really weird,1607882790,MMA
"If Gervonta Davis vs Ryan Garcia were to happen, who do you think woul win and why?",1610586867,Boxing
Anthony Pettis tells Ariel he was drunk when he accepted his fight with Tony Ferguson on 5 weeks notice.,1608156453,MMA
"If Conor McGregor wins at UFC 257, Dana White expects him to fight for the title and if he wins again to defend that title all in the same year",1610655244,MMA
Fine whatever,1607836354,MMA
"Opinion: Condit vs. Brown, better late than never?",1610655976,MMA
Julia 'the Jewel' Budd puts Talita Nogueira down with a low-kick + right hand to defend her 145 lbs title (and give Nogueira her 1st loss).,1609828523,MMA
New McGregor interview with John McCarthy. Im betting the house on McGregor,1610638813,MMA
Referee Isidro Rodriguez Blatantly Fixes a Fight (Coggi-Gonzalez) in 1994,1610385332,Boxing
Lightweight is STACKED!!,1608891394,MMA
Redditors who Train in Boxing,1608176436,Boxing
Tony Ferguson in the bedroom,1608400879,MMA
Josh Warrington To Return Feb. 13; Xu Can Title Unification Bout Eyed For Springtime,1610598272,Boxing
Boxing noob - want your thoughts on lightweight rankings,1609639314,Boxing
WBC To Review Canelo's Franchise Champion Status At 160,1608688482,Boxing
Wheres my Mass Effect fans at?,1607908976,MMA
Some Russian wrist snaps/ black voodoo magic,1609874677,MMA
UFC Fight Island 7: Max Holloway vs. Calvin Kattar Face Off,1610620407,MMA
Should Tony Ferguson have spent more time training with Eddie Bravo leading up to the Charles Oliveira fight?,1608083244,MMA
Top 10 UFC Fights in 2020! BT sport,1608739339,MMA
"Errol Spence vs. Danny Garcia, Fight Card &amp; Undercard, WBC World, IBF World Title Tonight",1607226075,Boxing
REquest r/nichole09x,1607834594,MMA
"Haney answers his critics, why he’s the best Lightweight, &amp; fighting Teofimo, Ryan Garcia and Tank.",1608831645,Boxing
Marlon Moraes latest wikipedia entry.. posting before it gets fixed.,1608427041,MMA
Has anyone buyed the Tristar(firas) striking instructional?,1608491929,MMA
The Count's cameo in Showtime's Warrior,1609742187,MMA
"Leon ""Rocky"" Edwards | UFC Highlights video I cooked up. Lemme know what you guys think of it.",1610163952,MMA
"Frank Warren: Joe Joyce now ranked No.2, will get WBO title shot in 2021",1607783997,Boxing
Canelo rejected 3 fight deal to fight Charlo and Plant for $75 million,1609179485,Boxing
Can someone explain this shit show?,1609161725,MMA
Amir khan vs Kell brook,1608289918,Boxing
Logan Paul Reacts To Jake Paul Knocking Nate Robinson Out,1606652478,Boxing
"UFC news: Commentary teams set for UFC 257, other ‘Fight Island’ cards",1610548161,MMA
Global Movie Star Tom Hardy Awarded BJJ Blue Belt,1609246236,MMA
"Casey Kenney on Dominick Cruz: “In your thirties, later on in your career, that [moving and cardio] might not be the best for him. So we’ll see if he still kind of brings the same style. I think he’s going to be just a little bit slower than he used to be and I’m going to capitalize on it.”",1610617999,MMA
Trifecta and weight misses,1608804692,MMA
The Genius Innovation Of Ryan Garcia: 3 Unorthodox Techniques The Legendary GOAT Uses To Take The Sport To A New Place,1609827319,Boxing
Haney has the best fundamentals in the lightweight division and is probably the most difficult fight for anyone in the division.,1610144837,Boxing
Miles Johns picked up a POTN bonus after grabbing the glove of Kevin Natividad before knocking him out with an uppercut,1609958232,MMA
Conor's interview with MacLife literally went private while I was watching it. Anyone have a reupload?,1610626136,MMA
"January 13, 2001 - 'Super' Zab Judah finishes Reggie 'Showtime' Green",1610552630,Boxing
What were your thoughts on the Whitaker vs Chavez decision?,1607129048,Boxing
Just how good was Prime Dereck Chisora?,1608928094,Boxing
"Triple C and Garth call out ""The Notorius Terrorist"" Conner MacGregor",1608884062,MMA
[Video] Boxing Training Motivation 2021 | No Fear,1609253892,Boxing
Tito Ortiz vs Alberto Del Rio,1610000733,MMA
Nakatani Suffered Fractured Right Orbital Bone In Knockout Win Over Verdejo,1608006198,Boxing
RIZIN Featherweight Champion Yutaka Saito counters Kazumasa Majima's takedown attempt with hard kicks and knees for the win,1610197531,MMA
It only needed 30 seconds for Khaos Williams to put Abdul Razak Alhassan away. Alhassan has never been KO'd prior to this,1608247799,MMA
Who remembers when Pacquiao Got Knocked Out ?,1606245142,Boxing
Boxer and PFL fighter Clay Collard rips Jake Paul: ‘I’d love to smash that guy’s face … he’s a joke’,1607797908,Boxing
Classic Rogan,1608928027,MMA
Amanda Ribas plans to steal the show at UFC 257: ‘I don’t want to be just a fighter on a Conor McGregor card’,1609517410,MMA
GEATHJE VS OLIVEIRA NEXT?,1609966819,MMA
"""Are you good?"": Stephen ""NMF"" Thompson stops punching to check on Geoff Neal",1610473501,MMA
Kovalev feints Cleverly using the pelvic thrust.,1610272708,Boxing
Jiu Jitsu Gi,1610336975,MMA
Best boxers with bad looking records that you can think of?,1606863925,Boxing
Coach Javier Mendez AKA Podcast 1st for 2021 &amp; New Fan Questions,1610038892,MMA
Would Canelo avenge Oscar if GGG almost kills him in the ring?,1608581661,Boxing
Bernard Hopkins: Loss of Canelo Still Tough To Swallow,1610315460,Boxing
Will GGG vs Charlo happen before he retires?,1608180916,Boxing
Best jabs in the heavyweight history of boxing,1609404957,Boxing
Muhammed Ali famous speech - what will you do after retirement?,1610472576,Boxing
(SPOILER) Finish to Nakatani vs Verdejo,1607838799,Boxing
Why is Callum Smith fighting a guy like Canelo with only a 4 week training camp?,1608410252,Boxing
How to watch the Tyson vs. Jones Jr. fight tonight?!,1606604456,Boxing
UFC fighter Irwin Rivera arrested and charged with attempted murder in Florida,1610083414,MMA
Yvon Michel: Oscar Rivas Is Open to Becoming First Bridgerweight Champion,1609106914,Boxing
Legend has it Nate is till sleeping,1606672379,Boxing
"Road to ""Chocolatito"" Gonzalez vs ""Gallo"" Estrada 2-Roman Gonzalez vs Rocky Fuentes",1610569418,Boxing
13 Reasons Why,1608916166,MMA
Watch!!LIVE!! DEADLIEST MATCH MIKE TYSON VS ROY JONES JR. https://t.me/tyson_vs_jones_live/11,1606612281,Boxing
EDDIE HEARN RESPONDS TO DANA WHITE and speaks ON CELEBRITY BOXING (JAKE ...,1609796340,MMA
I'm concerned for Tony Ferguson,1607837949,MMA
Okay but 60 seconds :-|,1610346358,MMA
Mike Perry's son is born,1609974561,MMA
"If Gervonta Davis vs Ryan Garcia were to happen, who do you think woul win and why?",1610586867,Boxing
"Alen Babić vs Adam Kownacki, who wins?",1609181795,Boxing
UFC 255 Fight Week Food Diaries: Episode 1,1608128804,MMA
[Spoiler] Littewada Sitthikul vs Julio Lobo,1608318063,MMA
Meet the Women's Flyweight Who Fought a Man 400-Pounds Bigger Than Her,1609902571,MMA
[Stephen Thompson] POST UFC Vegas 17 Fight Talk! *INJURY UPDATE*,1609305465,MMA
Should I do wrestling in HS?,1608783354,MMA
"Just saw this, does anyone know where it is from?",1607011985,Boxing
"Big John McCarthy thinks UFC will cut Tony Ferguson after loss to Charles Oliveira: ""Tony has always had an adversarial relationship with certain people with the UFC. He’s felt like he’s been held back, cheated in certain things. That’s okay, you can say those things when you’re winning.""",1608123608,MMA
Oscar De La Hoya wants to talk to Mike Tyson before deciding on his comeback,1610225164,Boxing
HIGHLIGHTS | Daniel Jacobs vs. Gabriel Rosado,1606544858,Boxing
[MEGA THREAD] Floyd Mayweather Jr vs Logan Paul,1607301235,Boxing
Is Kovalev an atg?,1609961302,Boxing
Jose Zepeda vs Ivan Baranchyk is named The Ring Magazine Fight of the Year 2020,1608661764,Boxing
Too much acidic for your teeth,1608938381,MMA
watch DC die inside,1608752985,MMA
Snoop Dogg is Launching a Pro Boxing League with Massive Fight in the Works,1606902158,Boxing
Charles Oliveira takes mount effortlessly and sets up a triangle against Tony Ferguson,1608340878,MMA
Mike Coppinger revealed the fight was in play shortly before Golovkin faced Kamil Szeremeta.,1609478552,Boxing
Dana White says McGregor vs. Poirier is for the number 1 contender spot but hinges on his talk with Khabib which will happen in-person on FI next week,1609897473,MMA
How do you feel about Rematch clauses?,1609842145,Boxing
타이슨에게 사냥당한 거인복서들. Mike Tyson Vs Biggest Boxers,1610446947,MMA
What is it that determines having a good chin?,1610174972,Boxing
Jake Paul says Amanda Nunes Would be and Easy Fight 🙄🤦🏻‍♂️,1608611184,MMA
Nina Ansaroff will fight Mackenzie Dern at UFC event on April 10th,1610505501,MMA
Give criticism y’all. A week in and the gym doesn’t have other sparring partners.,1608955906,Boxing
The greatest boxing entrance ever by Klitschko,1607906568,Boxing
UPDATE: The r/mma Virtual Championships,1607804590,MMA
Now lets take a look at the bantamweight rankings...,1608524906,MMA
Which boxing channel,1607707771,Boxing
Should I get a cobra reflex bag or a double end bag?,1610219255,Boxing
Andy “The Destroyer” Ruiz Jr. Former WBA/WBO/IBF Heavyweight Champion Of The World,1608961730,Boxing
Boxing youtube channels aimed at a femenine public?,1607694735,Boxing
"This is some International Fight Week level card 😳😳 Izzy going for champ champ vs Jan, Yan vs Aljo, GOAT Nunes, Rakić vs Santos!!!",1610072225,MMA
Manny Pacquiao MUST Retire BEFORE Taking Mcgregor Fight - Ducked Spence ...,1610500058,Boxing
How askren vs masvidal 2 would go down,1608916592,MMA
Why is Islam Makhachev fighting nobodies?,1608097407,MMA
I feel like Conor is going to run through the division if khabib is truly retired and his fight with Dustin will be as competitive as their first encounter.,1609599896,MMA
"Weekly /r/Boxing Discussion - What have you been watching? Recommend a fight -- December 29, 2020",1609243744,Boxing
Khabib Nurmagomedov Pressuring Justin Gaethje,1609961725,MMA
Could you beat Jake Paul?,1606682900,Boxing
Watch!!LIVE!! DEADLIEST MATCH MIKE TYSON VS ROY JONES JR. https://www.hdtvonlinestreaming.com/mike-tyson-vs-jones-live/,1606616249,Boxing
Anthony Joshua vs Kubrat Pulev predictions: Experts give their verdict on who will win the big fight,1607655647,Boxing
Andre Ward is the best boxer of all time,1607188523,Boxing
WIP Harry Greb,1606837915,Boxing
Hooker v Chandler for UFC257,1608679940,MMA
Matt Brown &amp; Carlos Condit share different predictions for their fight! | Mike Swick Podcast,1610633685,MMA
What you guys think of Don Turner's opinions?,1610560900,Boxing
"Merry Christmas and Happy Holidays, r/MMA",1608911112,MMA
Who wins 🥊,1607820395,Boxing
To accompany UFC choke analysis study: updated to include November 1993 through present,1609096988,MMA
"Scott Coker explains why he changed his mind, signed Yoel Romero to Bellator: “Yoel started with us in Strikeforce back in 2008.”",1609100471,MMA
Paleo vs Whole 30 vs Keto: How To Pick The Diet That Works For You,1608568234,MMA
How to Punch Bare Knuckle (YouTube Video),1607137399,Boxing
Juan Manuel Marquez underrated?,1610649419,Boxing
Israel Adesanya performs back to back finishes on açaí-fueled gorilla Paulo Costa,1609965671,MMA
A look at Deontay Wilder's training routine &amp; diet: “That’s old school; I stay away from road running because it tears up your knees over time.”,1609099491,Boxing
"Having his father as coach, A.J. McKee gets Khabib Nurmagomedov's retirement decision",1609779049,MMA
Will Wilder ever win a heavyweight belt again?,1608555765,Boxing
"Arum: Wilder Has No Rights To Third Fury Fight, Claim Will Be Denied",1607102429,Boxing
Any free streams of Garcia Campbell,1609619568,Boxing
"Scott Coker talks free agent Anthony Pettis, 2021 plans for Bellator | MMA Junkie",1608727108,MMA
Chael sonnen says the dumbest shit n acts like he onto som or super confident about it,1608457620,MMA
Has anyone been in a fight in public? Did you get arrested or did you get away with it?,1610224307,MMA
"Anthony Joshua dispatches aging top contender Alexander Povetkin in brutal fashion. AJ defends against another old man, mandatory challenger Kubrat Pulev, this Saturday on Sky Sports Box Office and DAZN. Live",1607706497,Boxing
Fantasy fight - AJ vs Young Foreman,1610624080,Boxing
[Image],1607874208,MMA
Watching this Classic! Reyes vs Jones. Who did you have as the winner? Also remember crowds at MMA events?! 😆,1609637643,MMA
UFC: Jiri Prochazka warns Israel Adesanya of dangers at light heavyweight – ‘he must be careful’,1609610218,MMA
Most heart in the Heavyweight division,1609099287,Boxing
3rd year Journalism student looking for internship in the MMA field,1607999441,MMA
Once again the Great vasily jirov vs James Toney Cruiserweight title match but i have a question? What was James Toney walkout music,1608166035,Boxing
Canelo in slow motion - “The Napoleon of the Boxing Ring” little video I edited.,1608598877,Boxing
Lomachenko talking about his loss to Lopez,1610279642,Boxing
I’m 16 and I’m really interested in boxing.,1609279088,Boxing
2020 Slow Motion Recap (feat. M83 ),1609664853,MMA
UFC Hall of Famer Tito Ortiz's tenure as a city council member already is a train wreck,1608080018,MMA
Rare in depth interview of Krazy Horse Charles Bennett smoking weed &amp; talking about his arrests &amp; time in prison *NSFW*,1609723888,MMA
An Examination of all of Mike Tysons Knockouts.,1608499759,Boxing
Conor McGregor Analysis his first fight with Dustin Poirier,1609354146,MMA
"Owen Roddy on McGregor vs. Poirier II: ""It's about when Conor hits him how long he can last""",1609273707,MMA
Just watched Coming to America this scene is so relatable.,1610368206,Boxing
Dmitry Bivol vs. Canelo Àlvarez - who wins?,1610503627,Boxing
Website to stream Tyson vs Jones Jr,1606593750,Boxing
Omari Akhmedov vs. Tom Breese moved to #UFCFightIsland8 on January 20th,1610491509,MMA
Where is Sergio,1608338287,Boxing
Why is no one talking about how bad the ref was in the Jake P vs Nate R fight?,1606675295,Boxing
Weekly Discussion Thread - Week 49 of 2020,1606754320,Boxing
"Despite the pandemic we managed to have a great year of fights, mostly without fans. Thank you to the r/MMA users that watched on UFC Fight Pass and hung out in threads, supporting regional MMA!!",1610058467,MMA
Weighing In (Big John &amp; Josh) FT CONOR MCGREGOR,1610634887,MMA
Michael Bisping 10-8’s Deron Winn in a Twitter spat,1608699053,MMA
Merry Christmas and Happy New Year to all the MMA Fans,1608917607,MMA
Unfazed Max Holloway Reveals His Plans to Recapture the UFC Featherweight Crown,1610636795,MMA
Who remembers this?,1609672063,MMA
Your Middleweight King Israel Adesanya wishes you a Merry Christmas,1608913107,MMA
Report: BT Sport win bidding war to show Tyson Fury's rematch against Deontay Wilder despite 'huge offer' well in excess of £10m made by Sky,1610630015,Boxing
"Brandon Moreno sends a message to Deveison Figuereido, making fun of “those ugly fucking clothes you wear”",1610125328,MMA
[SPOILER] UFC 256 Bonuses,1607841600,MMA
Good at the sex,1608887924,MMA
HE HURT HIM,1608933870,MMA
Nate Robinson gets knocked out clean by YouTuber Jake Paul in boxing match,1606626425,Boxing
How does the heavyweight scene play out next?,1607865670,Boxing
Canelo- Greatest ever,1608003278,Boxing
"Mike Tyson vs Roy Jones Jr, Two Legends Return, Fight Information, Main Card Starting Time",1606616432,Boxing
"Yoel Romero calls out Jake Paul ""I luhhh you, see you soon John Paul""",1608256600,MMA
Kell Brook responds to Chris Eubank Jr,1610627897,Boxing
KSW heavyweight champ Phil De Fries talks openly about his mental health issues &amp; career turnaround since getting help,1608042709,MMA
Who Should Coach The Ultimate Fighter Next?,1609876659,MMA
Joshua vs Pulev was not a good fight from the start,1608027167,Boxing
Average man vs Mike Tyson,1610591549,Boxing
Interrogation about injuries( neurologic problems) in amateur boxing ( training etc..),1609189214,Boxing
Jake Paul knocks out Nate Robinson 😲,1606625597,Boxing
Rashidi Ellis vs Eddie Gomez,1608905050,Boxing
[SPOILER] Junior dos Santos vs. Ciryl Gane,1607830234,MMA
How much money is actually going to charity from the Tyson Jones exhibition sparring match?,1606271115,Boxing
‘It’s just part of the gig’ - Dana White reacts to former UFC fighter Spencer Fisher’s admission of CTE symptoms,1610585808,MMA
Is Joe Rogan ignoring Chuck Liddell's Trainer?,1610255759,MMA
KA-KAWW,1608947388,MMA
Every once in a while we need to be reminded of greatness,1607782384,MMA
Main event fighters loses by fascinating method.,1608426894,MMA
"The Far Side comic strip by Gary Larson from Monday, November 30, 2020",1606792309,Boxing
"Tyson vs. Jones: KO is Possible, Three WBC Judges, Winner Will Be Announced",1606396461,Boxing
Text me,1609949251,Boxing
"Lomachenko vs Tank Davis, who would win?",1610064477,Boxing
Mike Tyson Versus Roy Jones Won't Be Your Typical Boxing Match,1606282945,Boxing
"MIKE TYSON CONFIRMS ""ABSOLUTELY"" FIGHTING AGAIN; PROMISES ""BETTER THIS TIME"" PERFORMANCE",1609294583,Boxing
Exclusive!!! KSI as he tweets that Jake Paul didn't do anything special,1606626548,Boxing
"Brett Okamato: Jon Jones will be FOTY in 2021, &amp; take a commanding lead on the GOAT conversation.",1610188807,MMA
Would love to get into this sport!,1607013315,Boxing
BREAKING: Charles Rosa vs Darrick Minner for Feb. 20th,1608334696,MMA
Boxing is Boring Man lol,1607282624,Boxing
Unfazed Max Holloway Reveals His Plans to Recapture the UFC Featherweight Crown,1610636834,MMA
Mike Tyson vs Roy Jones Jr. free stream?,1606594031,Boxing
Enough to make a grown man cry,1607835695,MMA
Romance game in world 8 ball pool golden shot,1606822432,Boxing
Joe Rogan’s commentating... Thoughts/Comments?,1608161497,MMA
Hey r/boxing,1608593799,Boxing
"So, here's the thing when legends return to combat.",1606617084,Boxing
WTF is happening to r/mma?,1608896587,MMA
Poirier vs. McGregor official poster,1608753952,MMA
Lowen Tynanes says he is still 'the same guy' after illness and injury,1608219612,MMA
That punch,1609870494,Boxing
"Got bored with no events this week, and designed a UFC 257 octagon lamp",1609598987,MMA
Top 10 UFC Fights of the Decade - EssentiallySports,1609104097,MMA
"[SPOILERS] Prelim fighter calls out the face of the realtor game, Al Iaquinta",1607834379,MMA
Pantoja hits a slick back take on Askarov. One of the best grappling fights in recent memory.,1610226219,MMA
Am I wrong for believing that Aldo is ahead of Silva on the list of all time greats?,1610431156,MMA
"[Aaron Bronsteter] ""Cody Garbrandt is targeting a bout with Jose Aldo in April.""",1610514176,MMA
"Road to ""Chocolatito"" Gonzalez vs ""Gallo"" Estrada 2-Roman Gonzalez vs Akira Yaegashi",1610396607,Boxing
"Jeff Chan (MMA Shredded) - ONE, Youtube and growing an Audience",1608682680,MMA
Anyone else think Errol Spence looks much older than before?,1606401664,Boxing
Did Tyron Woodley Just Tease His UFC Release?,1608744304,MMA
I have won the fight!,1606667324,Boxing
teep's UFC REWIND 2020,1609900679,MMA
Next honey pot?,1609612087,MMA
Boxing shoes,1606654072,Boxing
Big John's TOP 10 BEST FIGHTS OF 2020 | Bellator MMA,1609165329,MMA
Fight Night Champion,1609339122,Boxing
"Luis Reynaldo Nunez, let’s keep an eye on this guy for the time being",1608368015,Boxing
"Just joined a boxing gym, what should I expect?",1606430524,Boxing
Aerial view of a dazed Fedor on his knees as he eats four unanswered shots from Matt Mitrione before limply collapsing back and getting finished by KO a minute into round 1,1608488211,MMA
"Cris Cyborg talks Bellator fight with Cat Zingano, Moving up to 155 to fight Kayla Harrison",1609965189,MMA
What are the most important things when starting MMA Journalism?,1608498355,MMA
Terence Crawford is Afraid of Errol Spence Jr Vol 15: Crawford Turns Down Best Money of His Career!,1608504516,Boxing
sebastian fundora vs habib ahmed,1607271355,Boxing
I've built a tougher mentality - Joshua,1607404739,Boxing
Rewatching Ngannou v Miocic and spotted Ngannous brother in the crowd,1608279954,MMA
Canelo THE COWARD Alvarez DUCKS Jermall Charlo AGAIN Wants the Errol Spence Jr Fight,1608190254,Boxing
Mike Tyson - Till I Collapse (Knockout Masterclass),1607858393,Boxing
"🥊Fighting Fixx by BOXXER💪FREE, NO EQUIPMENT NEEDED boxing and fitness sessions⏰EVERY Saturday, 10am, BOXXER IG Live- https://instagram.com/boxxer?igshid=4e1r4kamic1l Now that gyms are closed, it’s important we stick together as a community and stay active during these times.",1610621392,Boxing
Boxing’s Best Rounds Part 1,1606851540,Boxing
Police Report reveals horrifying details regarding the arrest of UFC fighter Irwin Rivera,1610079859,MMA
"Marcin Prachnio and Khalil Rountree Jr. scheduled for UFC 257 on January 23, 2021",1607936611,MMA
Devin Haney Questions Vasiliy Lomachenko: “Do You Deserve A Shot Right Now? I Don’t Know How He’s Still On The Pound For Pound List”,1610655957,Boxing
Links/Stream,1609609634,Boxing
Is Tony Ferguson too small for 155?,1608417369,MMA
MMA Quiz Show,1608356598,MMA
The Sacrifice - 30 Days With: Ryan Garcia,1608229530,Boxing
Report | Mike Tyson and Roy Jones Jr. slated to earn huge paydays for Saturday's exhibition bout,1606284673,Boxing
Documentary About Fanman - The Guy That Interrupted Bowe-Holyfield On His Paraglider,1609539605,Boxing
Jake Paul knocks out Nate Robinson in 4:12 it was a two round knock out,1606631634,Boxing
Joe Rogan being shook by Iron Mike,1609839116,MMA
"Bisping says Jake Paul approached his management with a fight offer, says he's in",1608318915,MMA
New to boxing - what does “email belt” mean?,1610178711,Boxing
Wilfred Benitez - The Defensive Master,1607243480,Boxing
Schools in Ilinois,1609819393,MMA
Muay Thai Elbow Tactics: Nathan Corbett Film Study,1608651574,MMA
View on DAZN commentary?,1609702458,Boxing
"40 years ago today (November 25th 1980), the infamous “No Más Fight” took place. Roberto Durán giving up in the middle of the ring after being taunted and mocked by his opponent ""Sugar"" Ray Leonard.",1606280352,Boxing
Israel Adesanya Gets Knocked Out,1610441086,MMA
"“If you dont know, now you know” ABC Network edition",1610476783,MMA
