title,created_utc,subreddit
"Bob Arum has confirmed they have secured a location for Anthony Joshua vs Tyson Fury. Fight will be aired early US evening, UK prime time. Both fighters will earn close to $100m each.",1610626619,Boxing
Deiveson Figueiredo is The Body Lock’s 2020 Male Fighter of the Year,1609769618,MMA
Boxing paddles?,1607349065,Boxing
Wonderboy vs stylebender,1608495252,MMA
Muslim Salikhov is OUT of his fight against Santiago Ponzinibbio on January 16th. He is still suffering from health issues from COVID-19.,1608037178,MMA
"TIME FOR CHANGE- Anthony Yarde talks Lyndon Arthur, responds to Tunde Ajayi critics &amp; plans for 2021",1609181226,Boxing
Valuev vs Sidon - the weirdest fight ever?,1607518095,Boxing
Kattar VS Holloway main card breakdown &amp; predictions. Thoughts and feedback interaction appreciated 🙏🏾,1610562782,MMA
Jorge Masvidal indicates he’s leaving Twitter over Trump ban. His followers don’t seem to mind.,1610305350,MMA
Former WBC 122-pound titleholder Kazuo 'Royal' Kobayashi dead at 71,1607548336,Boxing
Prime Pacquiao vs Prime Duran @ 147,1610519774,Boxing
When THE BEST VS THE BEST in boxing Part 2,1609712057,Boxing
"Mike Tyson vs. Roy Jones Jr. fight purses: Legends make over $1 million, Jake Paul and Nate Robinson just $600",1606664761,Boxing
[QUESTION] Will all the young ones at 135 (apart from Teo) make it through to the elites?,1607519532,Boxing
What do you think will most likely happen if The Legendary GOAT Ryan Garcia fights Foam Bullet Gunman Gervonta Davis?,1609907756,Boxing
UFC anti-doping policy changes stance on marijuana; positive test no longer violation,1610644196,MMA
"2 years ago today HBO left boxing. To this day, nothing touches what they brought to the sport.",1607445362,Boxing
[UFC]The lost of a rival... @TonyFergusonXT 's reaction to Khabib's retirement is heartbreaking 🤬,1607736653,MMA
"Per UFC, Karl Roberson has withdrawn from Saturday's middleweight bout against Dalcha Lungiambula due to a positive COVID-19 test. This fight was originally scheduled to take place last weekend but was canceled after Roberson tested positive.",1608306597,MMA
Two hands behind the back Roy Jones Junior KO,1606443149,Boxing
B/R Staff Roundtable: FOTY and Other Questions That Need to Be Answered After UFC 256,1607992531,MMA
Eumir Marcial rocked Gabriel Rosado during a sparring session,1607791474,Boxing
Mike Tyson names only boxer who could take his power,1607262979,Boxing
Stiopic has a New Podcast with his friends called J.A.B.'s (@jabspodcast) click the link to check it out!,1607980236,MMA
Garcia’s performance Saturday was slightly reminiscent of De La Hoya’s first knockdown,1609735935,Boxing
How did you guys find the production quality by Triller for the Tyson v Jones Jr event?,1606687625,Boxing
Video: Manel Kape predicts ‘a f*ckin massacre’ should he get last minute call for UFC 256 title fight,1607794210,MMA
Cari Champion Ask Jake Paul If It Was Racist To Knockout Nate Robinson,1607566005,Boxing
8bit AJ,1607900635,Boxing
Floyd Mayweather VS Logan Paul Trailer,1608018057,Boxing
"Hernández: Canelo Alvarez had a chance to elevate his ambitions, and it's gone",1608521924,Boxing
Talkin Fight: The Scoop with Bola Ray,1610040531,Boxing
Would 2 minute rounds for male boxing contests up to (10 rounds) be a good idea for some fights?,1609599277,Boxing
Imagine not calling it this,1608885203,MMA
Where can I watch Muhammad Ali fights and other fighters of that era in the best quality available?,1608983486,Boxing
Wpuld rock climbing be a good workout for MMA training?,1609189757,MMA
Former UFC Champion Anthony Pettis To Jake Paul: Ben Askren is No Nate Robinson,1610212206,Boxing
"Corey Anderson: ""Everybody Knows Jon Jones Isn't The Greatest Striker"" I",1609104631,MMA
Jake Paul vs. Nate Robinson,1606623630,Boxing
As an American where is the most legit place i can bet on fights?,1610159439,MMA
mike vs roy,1606610950,Boxing
I have never punch. Can I learn in quarantine?,1609251801,Boxing
Joshua vs. Pulev - Final Press Conference!,1607688521,Boxing
"Adrian Yanez on Gustavo Lopez fight, his black belt in jiu-jitsu, quitting his job | MyMMANews",1610632406,MMA
Mike Tyson press conference 2020 honest and funny moment.,1610123509,Boxing
Talk About A Shoot Out - Wow,1608224568,Boxing
The Ultimate USADA Test From God,1609049107,MMA
"How are people comparing Jake Paul to Muhammed Ali it’s generally offensive to the boxing community, Jake Paul hasn’t even fought a real pro boxer",1606743730,Boxing
[Official] General Discussion Thread,1609477216,MMA
The Year is over Boys,1608434060,MMA
What’s your gauge on the Ryan Garcia v. Tank Davis fight after seeing both perform in the past recent months?,1609673318,Boxing
It do be like that,1610617296,Boxing
Bet against me boys! Vera and Neil to win!,1608429278,MMA
What happened to r/amateurboxing? Is it banned or set to private to clean some stuff up,1607875925,Boxing
Grasping Grappling 28: Knee Tap Sequence,1608576572,MMA
a pro of ngannou’s fighting style,1610589247,MMA
Dana White still loves the idea of Edwards vs. Chimaev despite recent hurdles,1610464608,MMA
Question For boxing fans???,1608604576,Boxing
Where did Pannie Kianzad go?,1607871508,MMA
PAC vs Spence,1607378605,Boxing
[FIGHT THREAD] Danny Jacobs vs Gabe Rosado,1606525757,Boxing
Mad mad mad respect to Tony's Mental Strength....,1607836983,MMA
"Looking for the ""Money &amp; the Hitman"" sky sports documentary, can anyone help me find it?",1609148514,Boxing
The way Canelo sets up combinations is on another level. P4P #1 Boxer today.,1608453699,Boxing
"January 2, 2010 - Junior Dos Santos drops and stops Gilbert Yvel at UFC 108.",1609617424,MMA
Gillian Robertson vs Pearl Gonzalez added to SUG20 Dec 30th,1609189737,MMA
"January 13, 2001 - 'Super' Zab Judah finishes Reggie 'Showtime' Green",1610552630,Boxing
Best Boxers to Watch and Learn from,1608389176,Boxing
I always get this ad when I go on this sub.,1608945905,MMA
Going to Canelo vs. Smith..what to expect as far as atmosphere?,1606714727,Boxing
Charles not interested in Justin,1610122259,MMA
"Manny Pacquiao vs Errol Spence Jr, Who would win if they fought next year?",1609160770,Boxing
The best Southpaw boxer of all time is.....,1607950360,Boxing
Someone isn't happy about Tyson-Jones...,1606589950,Boxing
Who would win in a fight?,1608916553,MMA
was lomachenko overrated? teofimo damn near killed him.,1609830891,Boxing
Walker v Crute Confirmed for March 26th,1609619564,MMA
"You guys love a slow mo, reminds me of Canelos deceptive body shot",1609687541,Boxing
A very cool breakdown of the AJ fight.,1608062754,Boxing
"[HISTORY QUESTION] Do old fighters like Moore, Robinson or Louis compare to the fighters in our era?",1608833629,Boxing
Canelo Alvarez is planning to unify super-middleweight belts in 2021,1609124789,Boxing
Cub Swanson refocusing on past strengths: I wanted to start back over,1608826077,MMA
"Max Griffin Trained ""4-On-1"" MMA: ""It Was Life Or Death""",1609621130,MMA
Philosophy: Does professional boxing show fans the best talent in a generation OR the best talent selected?,1607718843,Boxing
Shawn Porter sits down with Tommy Hearns,1608239558,Boxing
UFC should cut greg hardy,1608425117,MMA
"Lopez says that Lomachenko is 'number two' in the Lightweight division, but won't give him a rematch because he already beat him by unanimous decision. Urgh",1610549615,Boxing
How did Matchroom displace Queensbury as promoters on Sky in the UK?,1606576165,Boxing
Which one of you y’all did this 😭?,1606644560,Boxing
Weekly Discussion Thread - Week 50 of 2020,1607277683,Boxing
Blockbuster rematch looms between boxing icons Evander Holyfield and Mike Tyson,1610334826,Boxing
"Bellator fighter Robin van Roosmalen seriously injured, sister dies following car accident",1610645199,MMA
Dalcha Lungiambula will fight Isi Fitikefu at UFC event on January 20th.,1609257529,MMA
Claressa Shields Confirms PFL Deal: I Want Titles in Boxing &amp; MMA at The Same Time,1606837853,Boxing
Is Canelo the GOAT?,1608405342,Boxing
"40 years ago today (November 25th 1980), the infamous “No Más Fight” took place. Roberto Durán giving up in the middle of the ring after being taunted and mocked by his opponent ""Sugar"" Ray Leonard.",1606291304,Boxing
What are some of the best comeback fights in history?,1608860204,Boxing
"No 🧢, mayweather chooses his fights 🤦‍♂️ or Easy Money is just Easy Money",1607332346,Boxing
"Conor McGregor’s boxing coach, Phil Sutcliffe, on how they reconnected",1610607686,MMA
Welterweight No. 1 Contender,1607905219,MMA
Eugene Bareman unloads on Joseph Parker's team,1606322898,Boxing
Barry Hearn’s story about his deal with Don King,1610562285,Boxing
Mike Trizano vs. Rafael Alves on February 20th at a UFC event,1609383744,MMA
I'm looking for title fights or any really good boxing matches.,1609544857,Boxing
"Former NRL player Paul Gallen shocks Australia, beats Mark Hunt in six round slugfest",1608125920,MMA
What determines whether or not a boxer can carry his power up several weight divisons?,1609593332,Boxing
5 New Year’s Resolutions to Amp Up Your Programming Career | Learn with Me,1609618556,Boxing
Thank you r/boxing,1609452055,Boxing
Do u guys look at Odds?,1609520674,Boxing
I love how they're both so humble,1606419573,Boxing
MMA/Boxing Spotify Playlist,1608913393,MMA
Logan Paul vs Floyd Mayweather may be the single most egregious cash grab in the sports history.,1607372084,Boxing
Bob Arum '95 percent' sure Anthony Joshua vs Tyson Fury gets made | DAZN,1610642656,Boxing
[SPOILER] Saul Alvarez vs. Callum Smith,1608442280,Boxing
Streaming Roy vs Tyson for free or for less money,1606608744,Boxing
I think we have a real fight of the year contender here lads.,1609891293,MMA
Talkin Fight: My Two Minutes With You,1610125924,Boxing
GGG vs Kamil Szeremeta announced,1606256270,Boxing
Is he in his best shape ever??? probably,1610263415,MMA
If Ryan Garcia beats Luke Campbell in a fashionable manner would you consider him a top contender ?,1609608274,Boxing
Biggest L in boxing?,1606632690,Boxing
"Kovalev-Melikuziev in California, adds Jason Quigley vs Shane Mosley Jr",1610570455,Boxing
Talkin Fight: The Scoop with The Champ,1610161162,Boxing
"Who remembers this walk of GGG to meet canelo, I remember watching it live and it was so epic, having two of the best middleweights ever fight it off, it was such an iconic moment",1607361686,Boxing
Who will become undisputed at Light Heavyweight?,1607474445,Boxing
Mastery of counter strikes and defensive actions of the French boxer,1607337283,Boxing
Tyson vs Jones Boxing Streams,1606604867,Boxing
Boxing knockout,1609949551,Boxing
My very first experience,1607845003,MMA
GERVONTA DAVIS ON RYAN GARCIA SAYING HELL KO HIM IN 2 - OPENS UP ON THE MEGA FIGHT EsNews Boxing,1610039112,Boxing
Sylvester Stallone | Training For Rocky III,1610656479,Boxing
Mike Tyson Vs Roy Jones Fight,1606669872,Boxing
"The British Boxing Board of Control will be resuming Boxing tournaments under its jurisdiction in the middle of February, dates and venues to be confirmed in due course.",1610360076,Boxing
DUD FRAUDFORD SAYS SHAWN PORTER FIGHT NOT BIG ENOUGH YET HE FOUGHT MEAN GREEN MACHINE 🤣😆😂,1608406623,Boxing
"Lopez says that Lomachenko is 'number two' in the Lightweight division, but won't give him a rematch because he already beat him by unanimous decision. Urgh",1610549615,Boxing
MMA Awards: Tony Ferguson is named The People's Champ,1609327658,MMA
The Champ is Here - Does anyone still have the full version that includes George Foreman?,1610543218,Boxing
Talkin Fight: The Scoop,1610069185,Boxing
KING RYAN!!!,1609632417,Boxing
Challenges for beginners when they think how to start running,1609851045,Boxing
"2021: Someone’s 0 has got to go, mentally undefeated Sean O’Malley takes on another mentally undefeated champion:",1608947471,MMA
Jake Paul’s sex ban frustrates Insta sensation and World Series flasher Julia Rose,1606602118,Boxing
Mini Blessed or Mini Cursed?,1608916310,MMA
Darren Till agrees to fight Marvin Vettori,1607794954,MMA
Who is the best and biggest fighter Pacquiao could have beat in 2010?,1608479926,Boxing
[Motivedia] Ryan Garcia vs Luke Campbell - A Closer Look,1609514823,Boxing
"Anthony Pettis ha started his own management company, “Showtime Entertainment Group”",1608063891,MMA
Feel free to join my discord to chat about MMA or boxing,1610643177,Boxing
Conor McGregor Welcoming 3rd Child in 2021,1608860235,MMA
Highschool Boxing,1610568962,Boxing
Predicting Every UFC Champion in Every Division in 2021! | Open Mat,1610656789,MMA
Watch WWE Raw live,1610385531,MMA
Honorio Banario knocks out Jaroslav Jartim with a thunderous left hook,1609264620,MMA
What could i improve and how?,1609179159,Boxing
"Per sources, Jimmy Crute (@CruteJim) vs. Johnny Walker (@JohnnyWalker) agreed to for March 27. Sick matchup between some of the new blood at 205 ... really like this one. https://t.co/nGu7kf2YJ5",1609619150,MMA
Oleksandr Usyk 'has not given his consent' for Anthony Joshua to fight Tyson Fury,1610410996,Boxing
Tyson Fury confirms 2 fight deal with Anthony Joshua,1606663001,Boxing
Brazilian Jujitsu and it's place in Modern MMA,1609163559,MMA
Does anyone have a link where I can watch the Tyson vs Roy Jones fight online for free?,1606608076,Boxing
Muhammad Ali Gets Smacked Around By Tough Boxing Kid | VERY FUNNY!,1610333265,Boxing
"As a beginner: Does it take particularly long to get your hips stretched, e.g. for sidekicks?",1609168532,MMA
"""I truly believe I'm going to be the UFC Lightweight Champion this year."" - Michael Chandler",1610461785,MMA
Need help finding a martial art,1610572635,MMA
An interesting insight into the career of a journeyman,1609176570,Boxing
Murodjon Akhmadaliev vs Ryosuke Iwasa in the works for March 13th,1610406701,Boxing
Mike Tyson Vs Roy Jones Jr. Scored a DRAW????? What Now?,1606630011,Boxing
Deiveson Figueiredo - Death Rides a Buffalo ( little UFC 256 Promo I made),1607714405,MMA
Trump's lawyer said we could solve the election squabbling with trial by combat. Who could the GOP/Dems recruit to fight for them and who would win?,1609969422,MMA
"Ryan Garcia survives knockdown, finishes Luke Campbell with body shot in the 7th round",1609634489,Boxing
Jamal Yusupov vs Samy Sanna | ONE: Collision Course II | Main Event,1608908541,MMA
Boxers WHO SHOULD Be In The HALL OF FAME,1610578900,Boxing
Watch Fan made Promo,1609238653,MMA
Izzy with an OnlyFans,1609914684,MMA
Where does Terence Crawford rank in welterweight in terms of power? Is he the hardest hitter?,1609954588,Boxing
A Blessed Remix of Snoop's Boxing Commentary,1607309353,Boxing
Khabib wins sports personality of the year (BBC UK),1608248436,MMA
Best boxing knockouts of all time! (Part 1),1607191105,Boxing
UFC 257 will have a drive in showing at select locations - could this be Dana’s big plan to stop illegal streams ? 😂,1609967599,MMA
"Road to ""Gallo"" Estrada vs ""Chocolatito"" Gonzalez 2-Juan Francisco Estrada vs Brian Viloria",1609638765,Boxing
Best of 2020: Top Submissions | Bellator MMA,1608654854,MMA
Edgar Berlanga-anyone know if his fight will be on tv in a he US?,1607785925,Boxing
A few of Errol Spence Jr.'s counters against Danny Garcia,1607371271,Boxing
Stupide question I want to have some perspective on this.,1606625770,Boxing
"DIY boxing equipment at home, while at lockdown",1610299463,Boxing
Smesh Bro called this and everyone said Khabib has no clue what he is talking about.,1607837070,MMA
UFC fighters need to have Patreon accounts.,1610584992,MMA
EUMIR MARCIAL pro debut,1608526172,Boxing
Mark Hunt vs Paul Gallen,1608125110,MMA
"You are starting a rival promotional organisation to the big guys and you get to select 10 fighters without world championship belts as the first 10 fighters on your roster, who do you pick?",1606510306,Boxing
James Krause posts images of Diego Sanchez in his DMs asking for a fight,1609863875,MMA
"January 10, 2020 - Thanh Le finishes Ryogo Takahashi",1610302477,MMA
Jake paul vs Peter Mcneely,1609810513,Boxing
"Question: Are body shots from the ground legal? Instead of say, an armbar from reverse or modified mount, could you choose to just wreck your opponents liver into submission?",1609266990,MMA
(Spoilers) Booing from crowd effecting fighter,1609674062,Boxing
Ben Askren Acccepts Boxing Match Against Jake Paul on March 28,1608683820,MMA
Follow my instagram,1607857394,Boxing
Who's going to win I'm suck on this,1607326354,Boxing
Jon Jones getting stripped of his UFC 214 belt,1608946699,MMA
"January 14, 1984 - Milton 'Ice Man' McCrory finishes Milton 'Mad Dog' Guest",1610632864,Boxing
TC Boxing,1610651493,Boxing
Why Luke Campbell Shouldn’t retire,1610023175,Boxing
"Love AJ, but he’s reaching with this one, you didn’t want to stand and trade with chubby Ruiz, what makes us believe you’d do it in a third fight?",1607553314,Boxing
Strikes thrown after the bell,1609690300,MMA
Morning Report: Dan Hooker says lack of crowd is the reason for Charles Oliveira’s win over Tony Ferguson,1608140336,MMA
Building of UFC bettors and fans,1609373078,MMA
The legendary Nadia Kassem to make her pro boxing debut on March 27th,1610407128,MMA
"Justin Juuko; who fought the likes of Mayweather, Corrales and Cotto is being kept as a prisoner in Uganda with no access to a lawyer after supporting the opposition party",1608886480,Boxing
Team Nate,1606624571,Boxing
[SPOILER] Gennadiy Golovkin vs Kamil Szeremeta FULL FIGHT,1608364991,Boxing
[SPOILER] Pannie Kianzad vs. Sijara Eubanks,1608421633,MMA
Eric Spicely Hoping for Short Notice Turnaround to UFC on Fight Island,1610473636,MMA
Francisco Santana retires after knockout loss to Josesito Lopez,1607397549,Boxing
Some good domestic UK scraps to be had next year!,1609187900,Boxing
Dan “The Hangman”Hooker vs Michael “Ric Flair” Chandler is official for UFC 257,1609877893,MMA
Lol,1606629094,Boxing
"Breaking: Mr. 2020 Kevin Holland will meet North Carolina's Derek Brunson in a five-round main event at UFC Fight Night on March 20, per sources.",1609267195,MMA
I think Jake Paul KO's Bisping And Askren,1608909749,MMA
Would You Rather Be Hit By...,1608583503,Boxing
Mark Hunt swings at opponent Paul Gallen during weigh ins (alternate angle included). I didnt even realise he was fighting.,1608029304,MMA
What top 15 Heavyweights can Canelo beat?,1609258534,Boxing
Notorious and/or Underrated Yet Amazing Fouls,1608611329,Boxing
POV: You just admitted you haven’t watched Volk-Holloway 2 49 times,1608943692,MMA
"Mike Tyson vs. Roy Jones, Jr.",1606628771,Boxing
McGregor Helps MMA Gym Owner During COVID,1608069922,MMA
Average man vs Mike Tyson,1610591549,Boxing
Tyson Vs Jones Jr Stream?,1606605473,Boxing
Boxers who are the epitome of the wrongly labeled “Mexican Style”?,1608406782,Boxing
"Chris Eubank Jr. Eyes Golovkin Showdown: “It’s No Secret, I’ve Wanted That Fight For Years”",1610623169,Boxing
5 Years Ago Today: Conor McGregor Knocked Out Jose Aldo In 13 Seconds,1607787218,MMA
"McGregor on Khabib: ""How you could walk away at this stage is baffling to me"".",1610619013,MMA
HOOK A BROTHA UP SOS,1609623993,Boxing
DAZN Subscription,1608260744,Boxing
ONE MILLION SUBS - Viral Moment Celebration | Bellator MMA,1608145580,MMA
"Demetrious Johnson's training routine &amp; diet: ""For me, it’s about being consistent, day in and day out.""",1607802535,MMA
Help me out,1610640479,Boxing
Chael Tito upvotes to the left,1609202683,MMA
Lomachenko speaks for the first time since his loss to Teofimo Lopez,1608317792,Boxing
Need suggestions,1606969789,Boxing
Andrei Arlovski knocks out Paul Buentello in 10 seconds with one of the quickest and sneakiest punches you will ever see,1610248063,MMA
Is it possible to learn how to box without a boxing gym just a regular gym?,1607205615,Boxing
[Helwani] Holland insinuates he would be down to fight Chimaev … next week.,1607832147,MMA
Logan Paul vs. Floyd Mayweather,1607372585,Boxing
Does anybody know where I can find the Tommy Morrison episode of 30 for 30?,1608520315,Boxing
LIVE Gennadiy Golovkin vs Kamil Szeremeta Live Streaming Reddit Boxing Fight Online Fight Tv FREE Coverage,1608328359,Boxing
I made a Fantasy MMA app called Fanatics MMA,1610595492,MMA
Conor McGregor interview ahead of his bout with The Diamond,1610616549,MMA
Eimantas Stanionis vs. Justin DeLoach - Full Fight,1608135237,Boxing
Commentary,1607851884,MMA
What are some fights that have not yet been announced that you hope to see in 2021?,1608849046,Boxing
"Virna Jandiroba: My 'strong, old school' jiu-jitsu will best Mackenzie Dern at UFC 256",1607718366,MMA
Floyd Mayweather and Logan Paul looking to break PPV record 'by a long shot',1608890347,Boxing
Chito Vera calls our Marlon Moraes for his next fight,1609439129,MMA
Tony Ferguson - Yesterday,1608190706,MMA
Manager says Rose Namajunas ready for next title shot,1609800723,MMA
Main card fighter’s record as a result of tonight’s fight,1608426916,MMA
Prince Naseem Hamed and Kevin Kelley go to war,1610461130,Boxing
Why Does Kevin Holland Have A Suga Sean O'Malley tattoo?,1609943706,MMA
Great British boxers to never win a title,1607165223,Boxing
Is Tyson a problem for today's heavyweights?,1606671659,Boxing
😂😂,1610235194,MMA
2020 what wild year it's been..,1608296691,MMA
Interesting fact about the UFC Apex,1608411952,MMA
"The Ladies discuss Lyndon Arthur and Anthony Yarde, Spence vs Garcia and AJ vs Pulev",1607643832,Boxing
The return of the Notorious Conor McGregor will take place in Abu Dhabi on January 23 2021. McGregor faces Dustin Porier as his opponent.,1609322689,MMA
Fighting in the Age of Loneliness: Supercut,1609309501,MMA
John Fury (Drum&amp;Bass Remix) ♫,1607881626,Boxing
[SPOILER] Billy Joe Saunders vs. Martin Murray,1607122461,Boxing
(SPOILERS) Manel Kape with some strong words for tonight's main event combatants,1607844113,MMA
Moruti Mthalane-Jayson Mama Title Fight Canceled By Boxing South Africa Commission,1608223221,Boxing
Joshua vs Pulev,1607816985,Boxing
Rocky | Music &amp; Ambience,1608938345,Boxing
Canelo alverez destroyed callum smith,1610115466,Boxing
Ed Parker Demonstrates Judo | The Lucy Show 1963,1609728176,MMA
Cody Garbrandt and Sean O'Malley talking mad shit to each other on Twitter,1608275257,MMA
RIZIN 26 pick Asakura or Horiguchi??,1608595235,MMA
"""I have killed kids and women. I have seen friends burn alive. I could have nightmares or be a medicated PTSD victim. I'll tell you how to get better. You stop being a pussy."" - Tim Kennedy",1609811692,MMA
"Hypothetical situation: Wilder Fury 3 happens, Wilder BEARS Fury... what happens next?",1607384493,Boxing
"Who on r/Boxing answers polls with the least likely option, just to upset the polls?",1608176602,Boxing
Couple Guys Talking About the Jake Paul Debacle,1608184019,MMA
Best Boxing news app,1607638576,Boxing
Roar Championship 2 fighter,1609732948,MMA
Meng Bo vs Samara Santos set for ONE: Unbreakable Dec 22nd,1610049548,MMA
[Official] Shitpost Sunday,1609041985,MMA
Boring AJ,1607815403,Boxing
"I realize it's an exhibition, but...",1606629818,Boxing
‘I think the rankings are bulls—t’; Santiago Ponzinibbio not happy about losing his spot due to inactivity,1610131128,MMA
"Four years ago today, Dominick Cruz delivers one of the greatest perspectives on losing in his UFC 207 post-fight presser.",1609377505,MMA
(White shirt) I’m starting to get into boxing. Would just like to see some feedback on how I did and what I should of done differently. (Big hit at the end),1608447972,Boxing
Top Finishes: Fight Island 2020,1610140897,MMA
"In war, they do not look good or bad, everyone dies, who is well prepared for this war and will win! I don't like it when people say after a defeat, it must be accepted with dignity ☝🏼",1610613811,MMA
I know its not related but i started a new brand selling sports (Boxing) ties i hope u check it out and tell me your opinions,1607888133,Boxing
5 Defining Moments: Weili Zhang,1610100353,MMA
People are starting to find out Ryan Garcia doesn't speak Spanish. Many hispanics find that to be a turn-off.,1609887461,Boxing
Looking for a stream for AJ Vs Pulev,1607789392,Boxing
What’s up with the Wednesday Jan 20 card?,1608614399,MMA
Elias Theodorou pre usada,1608918023,MMA
Who wins David benavidez vs Canelo,1608339720,Boxing
Colby Covington Dropping Fighting Pointers.,1610613526,MMA
Golovkin's Masterful Jab | Boxing Technique and Fight Breakdown | Film Study,1609875339,Boxing
Dana White warns ‘don’t even get yourself excited thinking about Jon Jones vs. Israel Adesanya’ yet.(@DamonMartin ),1610553798,MMA
Barry Hearn’s story about his deal with Don King,1610562285,Boxing
[SPOILER] UFC 256 bonuses,1607841550,MMA
I talk funny,1606457213,Boxing
WBC Prez Smiles: I Will 100% Support Mayweather vs. Paul,1607471447,Boxing
Question: Boxing Brand,1609703518,Boxing
Tyson Vs Jones Jr Draw Officially,1606627859,Boxing
First time on the heavy bag I'm 16 years old any tips? What do you guys think,1608391906,Boxing
"Team Charr: Very Unprofessional Of Don King; WBA Must Follow Rules, Make Right Decision",1610339379,Boxing
Froch Views Joe Joyce as The Next Big Threat at World Level,1610210808,Boxing
Which boxers in their prime would be likely to beat Tyson Fury?,1607129997,Boxing
5 times Rayan Garcia Shocked Boxing World,1609720311,Boxing
Mystic Khabib predicts McGregor beating Jose Aldo and their fight at lightweight,1609439854,MMA
“Anthony Joshua vs Tyson Fury location secured with both fighters set to earn ‘close to 100 million’ reveals promoter Bob Arum,1610643178,Boxing
