title,created_utc,subreddit
Any links to AJ fight?,1607797428,Boxing
"Report: Ben Askren to box Jake Paul on March 28, 2021",1608735186,MMA
Please can someone hook me up with a stream?!,1607813046,Boxing
Why this subreddit has Paulie Malignaggi's botched up face from sparring with Conor as profile picture?,1607786276,Boxing
That shot on Campbell! An explanation of what Luke’s body went through after that hook,1609746455,Boxing
"Fury dismantled Wilder, arguably his only competition. Is Fury in the conversation for top 3 heavyweights all time?",1607597579,Boxing
Dustin Poirier | This Past Weekend w/ Theo Von #316,1610034287,MMA
"Mike Tyson says Boxing Owes Jake Paul, Logan Paul, KSI &amp; YouTube Boxers: ""UFC Was Kicking Our Butt""",1606772150,Boxing
Anybody have link for Tyson fight tonight?,1606616866,Boxing
Mike Tyson (220.4 lbs) and Roy Jones Jr (210 lbs) weigh-in,1606512206,Boxing
Wonderboy vs stylebender,1608494938,MMA
UFC Lightweights in VHS Style with additions from /r/MMA,1608070342,MMA
"Mark Coleman brutally ends Igor Vovchanchyn's 37 fight unbeaten streak with knees, then falls off the ropes in celebration at the Pride Grand Prix 2000 Finals",1610211712,MMA
"Devin Haney: Teofimo Request $10M to BLOCK the Fight, Lopez gets $3M to Fight Josh Taylor.",1608699337,Boxing
He Got Off The Bus,1608919750,MMA
Rampage Jackson gets netted on national TV by Forrest Griffin,1609345506,MMA
Will someone explain to me why the Tyson/Jones Jr. fight was called a draw?,1606793233,Boxing
How is Jake Paul being compared to Muhammed Ali they are two people with A MAJOR DIFFERENCE in skill and Jake has never thought a real pro boxer in his life,1606743548,Boxing
"Anthony Pettis not stressed about contract:""I've been on the chopping block for a long time. My performances are going to dictate what happens next.""",1608181159,MMA
Anthony Joshua vs Tyson Fury location secured [Barbershop Conversation],1610616427,Boxing
Gaining weight while boxing,1606295846,Boxing
"About five and a half months ago, Jiří Procházka made his unusual and spectacular UFC debut.",1609090109,MMA
2020 Fan Choice Winners,1610553106,MMA
"Michael Chiesa: I love being analyst, but end goal is UFC commentary",1610471286,MMA
"Interesting Stat: During the TUF 25 Finale, Jesse Taylor (0-1 UFC) took on Dhiego Lima (1-3 UFC) - despite their less than stellar official UFC records, together they possessed an absolute astonishing 13-0 TUF Record.",1608068438,MMA
😂,1610044495,MMA
[SPOILER] Winner of Junior dos Santos vs. Ciryl Gane Post-Fight Press Conference,1607833683,MMA
Jake Paul Knocks Out Nate Robinson,1606631525,Boxing
Rob (insert type font style here) Font,1608427297,MMA
Classic Bellator,1610440767,MMA
"The Rich, Violent History of New Year’s Eve MMA in Japan",1609847473,MMA
Southpaw,1607476080,Boxing
Does Canelo have a padded record?,1608760796,Boxing
"Statement on Khamzhat Chimaev via his manager Ali Abdelaziz ""Khamzat had coronavirus and when he went back to gym, his lungs did not recover 100%. He needs time for his lungs to recover, and right now it's about taking that necessary time.""",1609349255,MMA
New UFC P4P Rankings,1609134105,MMA
Floyd Mayweather eyes more fights when he's done with Logan Paul,1609181768,Boxing
Will boxing help my confidence?,1606849083,Boxing
"Sebastian Fundora-Habib Ahmed Set, Jorge Cota Positive For COVID-19",1606941458,Boxing
Does anyone use this app? Can you Watch all big fights? Is it any good?,1607789986,Boxing
[SPOILER] RIZIN 26: Kai Asakura vs. Kyoji Horiguchi,1609420782,MMA
Jack Slack Podcast 1: The 2020 Slacky Awards,1609778617,MMA
Realization Post-Tony Ferguson vs Charles Oliveira,1607837364,MMA
"McGregor vs Cowboy reportedly did 1.3 million PPV buys, making it the highest selling PPV in 2020",1608588830,MMA
"Melikuziev Still Wants Kovalev Fight, Doesn't Care About Failed Test",1610653183,Boxing
Logan Paul vs Floyd Mayweather - Big News Total Madness!!!,1607466587,Boxing
I'm never gonna get over this.,1608921337,MMA
When Fighters Lose Control,1606869850,Boxing
COVID-19 led to Khamzat Chimaev withdrawal from headliner,1609344821,MMA
"Tenshin Nasukawa breaks baseball bats with his shin, claims Guinness World Records title",1610638102,MMA
If Spence and Crawford fought each other next would the winner leapfrog to #1 P4P status in your opinion?,1610642336,Boxing
Who would win?,1609909454,Boxing
DC and Max Holloway have an exchange about who could beat the other,1608829937,MMA
Can we talk about gloves?,1608295453,Boxing
Who wins the fight next week?,1609087855,Boxing
"Road to ""Gallo"" Estrada vs ""Chocolatito"" Gonzalez 2-Juan Francisco Estrada vs Giovani Segura",1610482942,Boxing
Jake Paul vs Badr Hari?,1609250380,MMA
WBC's New designed belt for the Errol Spence vs Danny Garcia winner,1606848572,Boxing
Mikuru Asakura vs Satoshi Yamasu | RIZIN 26,1609416135,MMA
I just saw Israel Adesanya at the airport,1609215827,MMA
Max Holloway will not spar ahead of Calvin Kattar fight,1608097176,MMA
Merii Kurisumasu!,1608928633,MMA
"Tyson Fury on Anthony Joshua - ""Boxing is all about who is in form and who isn’t. On his last two fights he’s not in form, I am. Momentum is with me and I just believe I take him out early, very early. Maybe even one round, two rounds.""",1609766562,Boxing
Andrei Arlovski knocks out Paul Buentello in 15 seconds with one of the fastest punches you’ll ever see in MMA,1610122863,MMA
"Ronald ""Winky"" Wright turns 49 on this day, here's him getting knocked down by Peter Quillin.",1606419919,Boxing
Hypothetical matchup,1608091310,MMA
Michael Bisping responds to Jake Paul’s boxing match call-out,1608335748,MMA
Who would you most like to see in the UFC?,1607772171,MMA
UFC 257 Look Ahead - Poirier vs McGregor 2,1609873528,MMA
"TOP PROSPECT ""PRINCE"" LUCAS BAHDI LOOKS TO BE MENTIONED AMONGST TOP NAMES AT 135",1609003035,Boxing
What is Jon Jones’s way of blocking?,1609623333,MMA
For the clowns telling me that Conor isn’t ranked at WW right now,1609620779,MMA
"Really happy for Joyce, I hope he has a nice career and makes good money",1606712810,Boxing
Notifications when fights start?,1607217884,Boxing
"Like Father, like Son",1609640599,Boxing
Roxanne Modafferi: Breaking a Career Trend with a Winning Streak,1610016022,MMA
[Official] UFC Fight Night: Thompson vs. Neal - Live Discussion Thread,1608339103,MMA
World’s Youngest Black Belts | Ages 4-8 | How Young is Too Young?,1608515467,MMA
"Stephen ""Wonderboy"" Thompson making Jorge ""Gamebred"" Masvidal slip.",1608236286,MMA
Dana White says middleweight is 'most stacked' division in UFC,1610058538,MMA
Jake Paul really angling for fight with Conor McGregor. Provides us with a drive-by on Dillon Danis.,1608075553,MMA
Fight breaks out after Fight Nights Global Event between Magomed Ismailov and Vladimir Mineev,1608919857,MMA
"Former UFC Contender on Cannabis use ""This is the number one thing you need to be doing over any kind of Advil, anti-inflammatory, opiods...""",1608139247,MMA
On Paulo Costa's YouTube channel - Whittaker vs Paulo Costa Borrachinha,1607724260,MMA
How to get into fighting,1607904363,MMA
Judging Practice,1608353660,Boxing
Weakest HW champ in recent years 2000+ years,1606409932,Boxing
"UFC, Onnit, 10Th PlanetBrendan Schaub and Tito Ortiz among those who received COVID-19 relief loans",1609618630,MMA
Conor McGregor vs Diego Brandao,1610483129,MMA
Who's gonna be the best at Bridgerweight?,1607727791,Boxing
Cool spinning heel kick finish by Rade Opacic against Errol Zimmerman in the last OneFC event,1607785043,MMA
Full Fight Card for ONE: Unbreakable announced,1610469890,MMA
test ignore pls,1609359433,Boxing
Is Eddie Hearn a good promoter?,1609214845,Boxing
"[Official] General Discussion Thread - December 19, 2020",1608350805,MMA
Max Holloway vs. Calvin Kattar: Pre-Fight Breakdown,1610379197,MMA
"Jake Paul throws water balloons at Dillon Danis in drive-by attack: “Hey look, it’s Conor McGregor’s bitch right there!”",1608097052,MMA
Check Out My Video About Jake Paul vs Nate Robinson Fight! 🥊😵,1606634551,Boxing
"How to Progress in Striking/MT/K1? [Roadmap, Concepts, Resources]",1609344396,MMA
Tyson Fury one hour podcast with Paul Mort,1609850811,Boxing
"🥊Fighting Fixx by BOXXER💪FREE, NO EQUIPMENT NEEDED boxing and fitness sessions⏰EVERY Saturday, 10am, BOXXER IG Live- https://instagram.com/boxxer?igshid=4e1r4kamic1l Now that gyms are closed, it’s important we stick together as a community and stay active during these times.",1610621392,Boxing
Two questions: Is Tony Harrison retired? And where is Gus Johnson?,1609503683,Boxing
"Tyrone Spong has DEVASTATING KNEES - Featuring Henri Hooft, Aung La N Sang, and Gilbert Burns",1609610121,MMA
Sergey Kovalev vs. Bektemir Melikuziev on January 30 in Crossroads Battle,1608166313,Boxing
Jon Anik on The Lucas Grandsire Podcast,1609865709,MMA
"Deiveson ""Deus Da Guerra"" Figueiredo lands a missile that puts Joseph Benavidez down",1609865946,MMA
Is James Johnson cappin about this fighting shit?,1610644988,MMA
A smiling Sonny Liston in full Tartan Regalia,1606822266,Boxing
"Bisping Puts $1,000! On u/calpolkid to Fight Comedian Luis J Gomez!!!",1610192966,MMA
Interview with UFC Fighter Mike Davis (Fight booked 1/20/21),1609430362,MMA
"If had to choose which one of these behemoths you'd have to fight in the octagon, who you choosing and how you dying? Bruce and mario not optional",1609349789,MMA
Pat Miletech fired from LFA after attending Capitol riot,1610546176,MMA
Former K1 Grand Prix Champion Mark Hunt has lost his boxing match to Paul Gallen,1608132083,MMA
Scott Coker unsure about Ilima-lei Macfarlane-Juliana Velasquez rematch,1609201664,MMA
Anthony Pettis announces he’s a free agent after parting ways with UFC - MMA Fighting,1608690013,MMA
An interesting title,1609941298,MMA
Both of Carlos Condit’s last two opponents have died of Heroin overdoses and been revived,1610654784,MMA
We spoke to a main card winner earlier this week before he earned a brutal finish tonight. Tune in!,1608427476,MMA
"Happy New Year, everyone!",1609427018,Boxing
"Vasiliy Lomachenko Describes The Power Of Teofimo Lopez: “He Is A Strong Guy, He Hits Hard”",1609826108,Boxing
A rare Canelo moment speaking in English,1608463380,Boxing
LO QUE USTEDES VEN LO QUE YO VI ❤🔥 FREE FIRE CHALLENGE | EPICO 你看到我所看到的挑...,1609129555,MMA
Which boxers started training late in life?,1609727639,Boxing
Do you think some fighters have agreements behind the scenes to sell fights with fake drama?,1610119763,MMA
UFC 257 Lightweight Main Event,1609246431,MMA
Kevin Holland says the ufc should call him to fight Leon Edwards on Jan 20,1609260087,MMA
GOATs in UFC tournaments,1610620621,MMA
Sugar Ray Leonard vs Wilfred Benitez | ON THIS DAY FREE FIGHT | Leonard Becomes Champ,1606782134,Boxing
Free Fight: Weili Zhang vs Joanna Jędrzejczyk,1609532121,MMA
A matchup between Emily Whitmire and Hannah Cifers will take place at the UFC’s event on Feb. 27,1608667496,MMA
How to become a Mixed Martial Arts Agent to sponsor foreign fighters to US (on P-1 visa)?,1609997255,MMA
Free link to UFC 256 main event?,1607826322,MMA
Adam Smith has been commentating on the World Darts Championships,1608213493,Boxing
Help me watch the fight tonight please.,1606612027,Boxing
How many PPV buys does AJ vs Fury do in the UK? How many in the States?,1608144763,Boxing
Mike Tyson boxing combos. Powerful combos,1609691738,Boxing
Boxing podcast suggestions,1607584157,Boxing
Khamzat Chimaev all fights before UFC,1609187123,MMA
CONOR MCGREGOR v DUSTIN POIRIER 2,1610202988,MMA
"Manon Fiorot gets her 5th KO win against Gabriela Campo, she makes her UFC debut against Victoria Leonardo on January 20th",1610313999,MMA
How does prim Mike Tyson do against other greats (or very goods) in their prime?,1606891300,Boxing
WBC title on the line for Canelo vs. Smith,1607719793,Boxing
All January 2020 UFC Finishes,1608570110,MMA
Canelo vs. Avni Yildirim To Take Place 2/27 In Canelo's Birthplace Of Guadalajara,1609022816,Boxing
Is canelo alvarez gay?,1609829055,Boxing
Tito Ortiz talks about his UFC 106 fight against Forrest Griffin (the infamous “cracked skull” fight),1610643274,MMA
"The training routine &amp; diet that helped Bernard Hopkins win a world title at 49 years old: ""I’m not the most talented fighter of the last 20 years. Roy Jones was talented. But my work ethic overrided all the super talent.""",1609193354,Boxing
[Okamoto] Plan is to rebook Edwards/Khamzat Chimaev at some point.,1609387928,MMA
Deiveson Figueiredo &amp; Brandon Moreno landing huge shots on each other (in slow motion),1609954846,MMA
Khabib's first and last fight ending the exact same way,1609079547,MMA
"Pacquiao Confident of Victory, Feels Spence is Slower Than Thurman",1610478629,Boxing
How Would the Sport change if there were no Rounds?,1608672184,MMA
Jake Paul continues to win and creeps with Dillon Danis GF post TP to Dome,1608179863,MMA
"""Put a camera on us for 24 hours and you’d see who the real man is."" - Looking at Anthony Joshua's daily routine.",1607721935,Boxing
If headbutts were legal in UFC would the ufc champions be the same?,1608979454,MMA
Conor Mcgregor &amp; Dana White Love Story Movie Trailor,1608782042,MMA
"Henry Cejudo admits he will come back, wants to negotiate a deal with Dana. About Deiverson Figueiredo ""He has no grappling, I'm more Brazilian than him. For me, this guy is Paraguayan [...] he's babysitting my belt""",1610286738,MMA
Boxing Challenge,1609301034,Boxing
Pacquiao will fight Spence. Mayweather will fight Jake Paul.,1607453830,Boxing
Does a rule exist which doesn’t allow me to block punches with a knee?,1609610289,Boxing
Top 10 Most Shocking Moments Between Fighters!,1610297475,MMA
The left hand of Errol Spence Jr. vs. the left hand of Danny Garcia,1607112235,Boxing
"Dillian Whyte Questions The Drive, Desire of Anthony Joshua",1610653587,Boxing
"Sister, manager of jailed UFC fighter Irwin Rivera speak out day after stabbings",1610200835,MMA
"Matt ""The Immortal"" Brown finishing his opponents in violent fashion. He is set to face another violent fighter, Carlos Condit, on January 20th",1609168405,MMA
Unpopular (?) opinion: I would suspend any boxer that says they have an intention to kill their opponent in the ring.,1608290183,Boxing
Eye Jab Ends Fight Within Seconds.,1610222757,MMA
Ryan garcia gloves,1608566301,Boxing
What is the purpose of using boxing gloves?,1608560447,Boxing
Gabriel Flores Jr. To Fight Jayson Velez 2/20 On Berchelt-Valdez Undercard,1610589044,Boxing
!!~ Welcome To Boxing Live Streams Mike Tyson vs Roy Jones Jr live Hd Tv Channels,1606834372,Boxing
Prime Nick Diaz vs Prime Jorge Masvidal,1610351798,MMA
Butaev vs Chatwood Full Fight - Didn't know Butaev fought last month!,1610647205,Boxing
Raphael Fiziev knockout,1607828385,MMA
Report: BT Sport win bidding war to show Tyson Fury's rematch against Deontay Wilder despite 'huge offer' well in excess of £10m made by Sky,1610630015,Boxing
At what weight should Joshua come in against Fury?,1608734316,Boxing
Oliveira the new t-ferg,1607866421,MMA
Dmitry Bivol: I Don't Want To Fight For The Sake of Fighting - I Want a 'Good Fight',1607662728,Boxing
Michael Johnson Knocks out Dustin Poirier from the crowd,1609264154,MMA
"I’ve started boxing and I need a strength and conditioning workout, any recommendations",1608143156,Boxing
Ex-UFC fighter David Mitchell opens up about the damage that MMA has left him with over the years. Great article.,1610556916,MMA
Ben Askren on how Jake Paul boxing match would play out,1608824678,MMA
"Hi, I've made a video on Fame MMA if that's something that interests you here is the video :)",1608383385,MMA
Canelo vs 12-year old Tyson at 165 but Tyson has hooves for feet and three tentacles instead of two arms.,1609684687,Boxing
Max Holloway &amp; Calvin Kattar face-off at Fight Island,1610640517,MMA
RESULT: Jake Paul v Nate Robinson Fight better than Jones Junior v Tyso...,1606642352,Boxing
Gerald Meerschaert reacts to Kevin Holland's post fight statements,1608021083,MMA
Some of the year's beautiful and heartwarming moments.,1609446626,MMA
"Five years ago today, Conor McGregor demonstrated that practice makes perfect",1607787234,MMA
Damn,1609452134,Boxing
"Point deductions, let's discuss em.",1607914779,MMA
Mike Tyson Reveals Exactly What Happened In His Infamous Street Fight With Mitch Green,1608246197,Boxing
"Dana talks on his loving relationship with Tito Ortiz, truly incredible how close they were.",1608921618,MMA
Woodley and Ferguson,1607882652,MMA
[Spoiler] Jimmy Smith Post Fight Breakdown: UFC 256!!,1607894952,MMA
stream all mma free,1609489109,MMA
You scared? Says the guy making the MMA fighter fight by his rules and not MMA rules lol,1607998424,MMA
Could Khabib have been an Olympic wrestler?,1608371045,MMA
Boxers need to learn from Jake Paul,1606996713,Boxing
"Rare official Deontay Wilder v Alexander Povetkin promo trailer from 2016, one of the coolest fight promos I’ve ever seen.",1610644853,Boxing
Petr Yan is KO’ing everybody on Twitter,1607790566,MMA
Guillermo Rigondeaux in super-slow motion,1608296662,Boxing
"Jose ""Scarface"" Aldo goes to the body of Marlon ""Magic"" Moraes. Both men are coincidentally fighting in the same card in around a day",1608312939,MMA
An interview with Cage Warriors Star Paddy Pimblett,1608662414,MMA
Michael Chandler vs Dan Hooker Odds,1609721087,MMA
"Dustin Poirier, Hip Surgery and mobility issues: UFC 257 Doctor Breakdown",1610255862,MMA
Holyfield officially calls out Tyson.,1606868712,Boxing
All significant strikes - Yoel Romero vs Chris Weidman,1608341508,MMA
[SPOILER] Mackenzie Dern vs. Virna Jandiroba,1607834187,MMA
"Rakhimov Tests Positive For COVID-19, Out Of 2/13 Title Fight With Joseph Diaz Jr.",1610656499,Boxing
Shakur Stevenson,1609736191,Boxing
Max Holloway &amp; Calvin Kattar face-off at Fight Island,1610640517,MMA
"Scott Coker says Anthony Johnson vs. Yoel Romero 'has a lot of heat,' discusses 205-pound grand prix",1608822355,MMA
Never Forget Kate Abdo Complimented Henry Garcia’s Sperm,1609959593,Boxing
Fantasy fight - AJ vs Young Foreman,1610624080,Boxing
Ariel reports that the UFC wants Stipe to defend the HW belt against Ngannou in March. Deal is not signed yet. Winner to defend against Jon Jones in summer if all goes to according to plan.,1608576739,MMA
Advantages in a fight or mma for being tall vs short,1609268809,MMA
Was Spence knocked Unconscious from his car crash?,1606861959,Boxing
Eugene Bareman: All City Kick Boxing fighters have got fights booked early in the year.,1610561834,MMA
So how would you guys rank the greatest LWs of all time right now?,1608627870,MMA
How many Jab variations exists? and what's the purpose of each one?,1607749786,Boxing
"[Stevie Ray] After some thought I’ve decided I’m going to fight again, I am still a free agent and not under contract with any promotion so not sure where yet but next year I will fight. Where/who would you like to see me fight? 🤔",1607728674,MMA
Highlights for anyone who wants them,1606631329,Boxing
Question: Would Conor Benn beat Chris Eubank Jr. if they weighed the same?,1606928612,Boxing
[Spoiler] Anthony Yarde Vs Lyndon Arthur - FULL FIGHT (HD),1607275878,Boxing
HW Champion Stipe Miocic &amp; family wish fans a merry Christmas.,1608934777,MMA
Is Conors gas tank bad at 155?,1610243996,MMA
[Official] Shitpost Sunday,1608437191,MMA
"From British fighter Paul Taylor’s record, is this one of the more bizarre reasons for a no contest?",1610017011,MMA
Can Mayweather still be considered a legend of the sport after his latest antics?,1610523396,Boxing
Nong-O vs Rodlek | Muay Thai Bantamweight World Title | ONE: Collision Course,1608303803,MMA
It's time the UFC added a general finish bonus.,1607887900,MMA
Ethicality of MMA,1610400200,MMA
Super Series 2021/2022,1610616877,Boxing
Georges St-Pierre 2021 Interview On His Journey To The Top Of The UFC (Full Podcast),1610373528,MMA
The lead right: why so underused?,1607971460,Boxing
Deiveson Figueiredo’s manager says UFC granted his wish to get PPV points - MMA Fighting,1609886556,MMA
"Billy Joe spelling Marc with a C, Markc will brighten your day",1609953893,Boxing
Diego Sanchez advises against little girls who aim to fight,1608235254,MMA
Hot Take: Loma is way better than Teo,1609404269,Boxing
Glover Teixeira - A Throwback Fighter,1608011075,MMA
Breaking!!!: Dana white recently revealed on The schmo's youtube channel that-what khabib said in his recent interview was that the winner of Conor vs dustin will be the number one contender and if Conor wins then they will try to make Conor vs khabib once again and try their best to convince khabib,1609398942,MMA
"Standing ovation for Callum Smith, such a great Champion!",1608695034,Boxing
"Xbox one, one s, one x Core Controller - Carbon Black",1607271420,Boxing
What future styles do you think could develop within boxing during the near future?,1608137692,Boxing
Kazuto Ioka is now rated #1 in the Super Fly division on Boxrec. Who would you like to see him fight next?,1609424916,Boxing
Volkanovski - Holloway II,1608783934,MMA
Canada’s #1 Professional boxer calls out Jake Paul,1606894407,Boxing
[Motivedia] Saul Alvarez vs Callum Smith - A Closer Look,1608285998,Boxing
Ryan Garcia vs Luke Campbell Full Fight | Pelea Completa,1609642273,Boxing
RDA Made Khabib Tap? Let's talk about it.,1608146120,MMA
New podcast,1607721102,Boxing
Ryan garcia vs like campbell edit. (my first boxing edit),1609854247,Boxing
ONX Sports Shady Business Practices,1609537751,MMA
Talkin Fight: Neil the Deal,1610056270,Boxing
The Bus Driver Uppercut from the end of UFC 221,1608928155,MMA
"To learn more about Boxing, click this link",1606862208,Boxing
Jose Aldo Song,1608431264,MMA
"Tim Tszyu vs. Bowen Morgan at Bankwest Stadium, Australia",1608232682,Boxing
who do you think would win?,1608199864,Boxing
All knee strikes from Masvidal vs Askren,1608467491,MMA
Matchup idea: Furgeson vs Cerrone 2,1608094631,MMA
MMA fighter and bare-knuckle boxer Artem Lobov hurting people for 10 seconds,1610233637,MMA
GSP: I never liked fighting,1610468290,MMA
Mike Tyson turning Roy Jones Jr.,1610285947,Boxing
"Rank these guys at 168, in their prime obviously",1610344568,Boxing
boxing taking leverage from ufc for survival?,1607117175,Boxing
Bellator signs 'Russian Ronda' Irina Alekseeva to multifight contract,1608857271,MMA
"Anthony ""Showtime"" Pettis knocks out Stephen ""Wonderboy"" Thompson with a superman punch. Both of them are coincidentally fighting in around two days.",1608236358,MMA
(david haye vs tyson fury) and (Klitschko vs Fury rematch),1609949579,Boxing
Anthony Joshua could retire in 5 years,1610323092,Boxing
[FIGHT THREAD] Shakan Pitters vs Craig Richards,1608313200,Boxing
Have I captured his good side? 🙌,1610401203,MMA
Prime Riddick Bowe Vs Current Tyson Fury,1609328574,Boxing
One of the most iconic boxing pictures in history and Ali,1606702335,Boxing
Chase Hooper on weight for UFC 256.,1607706478,MMA
Mike Perry gets his leg injured by glass,1609737172,MMA
Want Proof Positioning Is Everything?: Errol Spence vs Chris Algieri Knockdown 1,1607523885,Boxing
"Willie Pep, one of the greatest boxers to ever step in the ring",1609859378,Boxing
Chandler vs Hooker officially booked for UFC 257,1609713921,MMA
Weili Zhang Interview About Rose,1609866434,MMA
"Mike Tyson v Roy Jones Jr: Knockouts ARE allowed and the fight will have a winner even if no one gets knocked out, 3 judges will score the fight",1606569903,Boxing
Jose Aldo makes weight (136lbs) for tomorrow's event,1608312516,MMA
A dream fight for all MMA fans.. Khabib vs Gracie .. (good recovery ? Haha),1610508627,MMA
"First fight card of the year, and my teammates and I are breaking it down! Who you guys got?",1610460461,MMA
Merry Christmas you filthy animals,1608916337,MMA
The History of World Champions in Boxing,1608209412,Boxing
What are some of your all-time favorite fights?,1609881173,Boxing
Where a fella stream the Tyson fight folks?,1606597749,Boxing
Down Goes Frazier!,1609365002,MMA
[Official] Shitpost Sunday,1607832389,MMA
"With the eagle now retired I genuinely don't see anyone beating Conor, does anyone think he won't be the next champion of the lightweight division?",1609630606,MMA
Do you think they should allow more clinch work in boxing?,1608334198,Boxing
Tyson Fury on Anthony Joshua via twitter,1607816871,Boxing
KingRy has Earned his Moment | The One-Two,1609821406,Boxing
Was Sonny Liston The Most DANGEROUS Heavy Ever?!,1610143213,Boxing
Where have all the great American heavyweights gone?,1609472577,Boxing
[OC] TOP 5 MUST WATCH PROSPECTS IN BOXING | 2021,1609040045,Boxing
Dear Daddy #Execution22 Available Everywhere!⚡️,1608153152,Boxing
Someone give me a nice slug fest to watch before I smoke,1609133106,Boxing
"Hypothetical situation: Wilder VS Fury III happens, Wilder BEATS Fury...What happens next ?",1607384969,Boxing
Khabib Nurmagomedov's brutal weight cut for his fight against Justin Gaethje.,1608078912,MMA
"Hypothetically, if Mike Tyson fought Jake Paul in a boxing match, could Mike beat him?",1606680736,Boxing
Amanda Ribas Reunited with The Schmo Looks to Steal The Show UFC 257,1610461231,MMA
Ryan Hall vs Dan Ige apparently booked for UFC Fight Night on March 13th,1610656730,MMA
"NEXT Tyson FIGHT: manny, conor, evander or Uncle George Foreman?",1606663376,Boxing
Ultimate heavyweight tournament quarter finals,1607376740,Boxing
Holyfield rematch could be next for Tyson after Jones fight generates $80m | Mike Tyson,1607467873,Boxing
Karolina Kowalkiewicz Sings ACDC,1609014127,MMA
