title,created_utc,subreddit
A comparison of TJ Dillashaws weight cut at 125 vs 135. TJ is set to return next year.,1608588866,MMA
Jorge Masvidal Picking Donald Cerrone Apart with Teep Feints,1610653126,MMA
Canelo Alvarez VS Rocky Fielding,1608396982,Boxing
Khabib Nurmagomedov Knew,1607842441,MMA
"Still undefeated, Happy Holidays r/mma from No Ankles",1608913242,MMA
"Imagine this: a 7'4"" 385 pounds boxer with a 94 inch reach came along. Would he be at as big as an advantage as I think, or a disadvantage?",1609290513,Boxing
UFC 257 FACTS: CONOR MCGREGOR VS DUSTIN PORIER,1609989147,MMA
Kharitonov gives Big Country a big knee to win with 1 second left in the round,1608255244,MMA
I'm planning to buy cheap but good quality boxing gloves for bag works. Is the everlast elite training gloves good?,1607519887,Boxing
stream ryan garcia,1609530511,Boxing
"Teofimo Lopez: My Body Is Ready To Move Up, One Or Two Fights Left At 135",1610631185,Boxing
"Do you know that Leon Edwards has been calling out Masvidal since June 23, 2018 when he beat Cowboy Cerrone? Masvidal has ducked for over 2 years. Via: Mayowa Balogun on Twitter",1609295001,MMA
Event start times (start of prelims) for the first three UFC cards of 2020 per ESPN's online schedule,1609251390,MMA
What are your top 10 fights to watch?,1607412149,Boxing
Tyson fight live,1606623899,Boxing
"How to correctly pronounce Fighter’s names (Khabib, Adesanya, Yan, Fedor, Askarov...)",1607771308,MMA
Eddie Alvarez vs. Michael Chandler 1+2 Highlights,1609922673,MMA
He still got it!!,1609077723,Boxing
My friend Adrian Yanez received his BJJ black belt today!,1608618663,MMA
"Pat McAfee &amp; Stipe Miocic Talk Stipe's Next Fight, Being A Browns Fan, And More",1609982234,MMA
My predictions for Mike vs Roy tonight. Let me know your thoughts.,1606578614,Boxing
Could Jake Paul be the new butterbean,1607320838,Boxing
[SPOILER] Submission Underground 19 : Brent Primus vs Craig Jones,1608528003,MMA
"Anthony Joshua believes Oleksandr Usyk is a 'reasonable person' and is 'keen to step aside' as the IBF, WBA, WBO and IBO champion seeks to set up an undisputed world heavyweight title clash with WBC belt-holder Tyson Fury",1609793552,Boxing
Fight Island 7 Free Fight: Max Holloway vs Anthony Pettis,1610294726,MMA
Vitali fans do you think the stoppage against Lennox was justified?,1607095931,Boxing
Champ Shit Only 😢,1607862227,MMA
Hearn Confirms Usyk Will Leave Matchroom If Joshua Fight Isn’t Delivered Next,1610419428,Boxing
Is chin purely genetic or do boxers employ any particular “drills” to work on their chin?,1609361690,Boxing
"Ok, which one of you chuds did this?",1608426832,MMA
[SPOILER] Hamzah Sheeraz vs. Guido Nicolas Pitto,1606602536,Boxing
Edson Barboza being an incredibly painful nuisance to his opponents. Credit to u/RonanFob for the Dan Hooker part,1610136437,MMA
Sergey Spivak vs. Jared Vanderaa rebooked for UFC event on Feb. 20,1609773362,MMA
How should I deal with a girl spreading rumors in my gym?,1608877002,MMA
How did Lopez beat Loma in the early rounds?,1606810984,Boxing
"Alexander Volkanovski believes he’s going to ‘break’ Brian Ortega: “I believe I’m going to break him. The way that Max did, I believe that’s somewhere I can go with. Especially with my pressuring style. I get to be in his face which is fun and people want to see that.”",1609775428,MMA
10 minute kickboxing Fullbody workout for all levels,1610646132,Boxing
Can bouncers drop and attack their own back up like this?,1610570739,Boxing
Seems like Jake Paul is crossing the line here with his words towards Connor,1608048276,Boxing
Need some advice for equipment,1606667271,Boxing
Mike Tyson. Created by instagram.com/rphcolor,1607501758,Boxing
Colby Covington when he found out Jorge Masvidal was openly being a Trump supporter,1608932149,MMA
Does anyone know what time the canelo fight will happen,1608422928,Boxing
Charles Oliveira has been spending time donating food to his community,1609378120,MMA
Ryan Garcia isn’t that good,1609650003,Boxing
What are your reasons for not including Khabib in your all-time GOATs Mt. Rushmore?,1609763711,MMA
Can I become a Mixed Martial Artist?,1608583803,MMA
Mike Perry got Cut,1609720486,MMA
Happy Boxing Day!,1609002306,Boxing
ESPN Still Inexplicably Thinks Crawford is #1 P4p,1608862247,Boxing
What does Canelo need to do to surpass Mayweather and Pacquiao as one of the GOATs?,1608536274,Boxing
Meet Julija Pajic: The undefeated 6-foot fighter dropping two weight-classes to compete for Bellator MMA in 2021,1608412767,MMA
Thoughts of Jake Paul vs Nate Robinson?,1607356146,Boxing
"Is Roy sad? He keeps hugging Tyson, I cant tell if hes feeling a but blue:(",1606627425,Boxing
Wiz Khalifa,1606616424,Boxing
Boxing Streams Live,1608439183,Boxing
[SPOILER] Gennadiy Golovkin vs Kamil Szeremeta,1608343873,Boxing
Can anyone tell me if these are real or fake Twins boxing gloves?,1606652348,Boxing
Glenn McCrory eyes talks for bareknuckle exhibition vs. Evander Holyfield,1606942382,Boxing
"Joanna Jedrzejczyk lays out ideal scenario for UFC return: 'More money,' title shot and fans",1609960014,MMA
Boxing - Americans V. Britons (1943) [British Pathé],1608655724,Boxing
MMA Fighter and Kickboxer Qiu Jianliang Striking Breakdown,1610380927,MMA
Who are some of your favourite heavyweight boxers with very effective footwork?,1608768973,Boxing
The first episode of Renato Moicano's new podcast is currently live - with guest Antonio Carlos Junior aka. Shoeface,1608753112,MMA
In a match of absurd size disparity. 6’11 Semmy Schilt decisions 6’ Gokhan Saki,1608306094,MMA
Lyndon Arthur did win 1 handed,1607243455,Boxing
Who'd have won between the Wladimir Klitschko of 2010-2014 and Corrie Sanders?,1610079196,Boxing
Re-watching these legends and can’t help but post an appreciation post,1607302186,Boxing
"If Conor McGregor wins at UFC 257, Dana White expects him to fight for the title and if he wins again to defend that title all in the same year",1610655244,MMA
Is Leon vs Khamzat actually off,1608986044,MMA
Romero vs. Rumble,1608130663,MMA
Dana White on pitching Khabib: 'There's going to be no pitch. It's going to be a 5-min conversation',1610551349,MMA
🔥Khabib Nurmagomedov UFC Top Finishes,1609878116,Boxing
Gennadiy Golovkin vs. Kamil Szeremeta,1608345108,Boxing
"Once upon a time, Conor McGregor and Khabib Nurmagomedov predicted the rise and clash of one another.",1608006485,MMA
What's everyone's bets for tomorrow's Nate Robinson v Jake Paul fight?,1606543989,Boxing
Have they announced a start time for UFC 257?,1609549564,MMA
Hear me out: Usyk-Joshua and Wilder-Fury 3 are perfect fight for boxing right now,1607984279,Boxing
Simple trick to predict next year's champ in each division,1608915560,MMA
Daniel Jacobs vs Gabriel Rosado (27-11-2020) full fight,1606603179,Boxing
Canelo Alvarez vs. Callum Smith - Live Discussion thread over on /r/BoxingDiscussion,1608437041,MMA
"Closing as a nearly +1000 underdog, Emanuel Newton scores the upset against Muhammed ""King Mo"" Lawal with a vicious back fist KO",1610327597,MMA
Getting into the Business Side of Boxing,1609033564,Boxing
Just wanted to show you this Albanian king!,1608218473,Boxing
Can you freeze mma gloves and shin pads?,1609446814,MMA
Conor McGregor says he's confident the present version of himself would beat the snot out of the McGregors who fought Cerrone and Alvarez.,1610134537,MMA
Where can I watch big boxing matches?,1608660098,Boxing
Do you guys think Callum Smith has a chance against Canelo?,1607731547,Boxing
Chayaphon Moonsri has suffered his first career loss,1606521397,Boxing
This a Christmas fools joke... Conor # 1 P4P?,1608979073,MMA
What's your most satisfying ass whooping and why?,1608043584,Boxing
Does Logan stand a chance?,1607369095,Boxing
Marlon Vera armbars Brian Kelleher,1607929486,MMA
"ward vs kovalev, till this day, I've no idea how Ward managed to get the win, Kovalev absolutely outclassed him in their first fight, it wasn't even a draw they outright gave him the win",1606248196,Boxing
[Official] Moronic Monday,1610341277,MMA
"Conor McGregor on UFC 257, Dustin Poirier and Khabib's retirement",1610614851,MMA
CONOR MCGREGOR FINALLY RESPONDS TO JAKE PAUL!!!,1609940305,MMA
Prime Lennox Lewis VS. Prime Wladimir Klitschko,1610335245,Boxing
"""I was ready to enter a new chapter in my career. At this point, I'm in this sport for legacy and for the biggest-paying fights, and I just don't think that continuing on at light heavyweight was going to do much for my legacy."" - Jon Jones",1609436785,MMA
Conor at the thrift store,1609911493,MMA
"Documentary about the legendary fighter Joe McStan, who was kicked out of the UFC for his secret move",1608913010,MMA
Who are your four greatest pound for pound boxers ever?,1607924746,Boxing
"If Sergey Kovalev comes out and says he ate tainted Russian bull, would you believe him?",1610653128,Boxing
Is Kevin Holland as good as I think he is? Or did I just buy into the hype?,1607875089,MMA
Question,1606480705,Boxing
"I think everyone looked away here. Most ppl would’ve tapped, respect to Ferguson.",1607836820,MMA
Cro Cop helping unload humanitarian aid for earthquake victims in Croatia.,1609364752,MMA
Joe Joyce wants to fight against Oleksandr Usyk in April 2021,1610617174,Boxing
Just Kiss already,1606622960,Boxing
1919 Jujutsu Footage,1610454662,MMA
Eddie Hearn’s major statements on Anthony Joshua vs Tyson Fury in 2021,1607679294,Boxing
"Eddie Hearn - ""We're Coming Back With a F*cking Almighty Bang""",1610298799,Boxing
Any critiques/improvements regarding the Jab? (btw the video is mirrored im a southpaw.),1608588617,Boxing
Kid Yamamoto (RIP) flying knee picture (HELP),1608139545,MMA
An epiphany,1607724113,Boxing
Custom Jordan 1s - Mike Tyson Tribute,1606348921,Boxing
Kazuto Ioka vs Kosei Tanaka,1609099433,Boxing
'Lemme just dolphin dive real quick',1606624699,Boxing
Shane Mosley VS Zab Judah - Who would have won?,1609615287,Boxing
EP. 282: 6th Annual AFPA's - 2020 Recap Show with Jon Anik &amp; Kenny Flori...,1609779482,MMA
"Katidis vs Earl, a great war",1609397881,Boxing
Who would win a boxing match,1606965054,Boxing
Weili Zhang Training For UFC 256. You think she can handle Thug Rose?,1608193126,MMA
Jaime Munguia vs Liam Williams,1609846889,Boxing
"Road to ""Gallo"" Estrada vs ""Chocolatito"" Gonzalez 2-Juan Francisco Estrada vs Milan Melindo",1609797441,Boxing
"Jake Paul, best advertisement for boxing training?",1606672149,Boxing
Is speed in boxing genetical?,1609088018,Boxing
Can Logan Paul Beat Mayweather?,1608312063,Boxing
Manny Pacquiao: Southpaw Footwork,1606339519,Boxing
Best fights that can be made. Last segment.,1606444034,Boxing
Discussion: Do people feel like the UFC Heavyweight division has lost its charm?,1608630576,MMA
Does anyone have a playlist of fights I can watch to increase my knowledge on the sport and my ring iq?,1610558521,Boxing
Teo?,1609890718,Boxing
Current UFC champs vs the GOAT of their division,1609691803,MMA
Categorical Differentiation: A New Scoring System Concept,1608767088,MMA
Errol Spence Jr. vs. Danny Garcia inbox for live link,1607226132,Boxing
DC regretting his Popeye's pregame,1608427828,MMA
Daaaaayyyyyyuuuuummmm,1606625142,Boxing
"Per sources, light heavyweight bout between Nikita Krylov and Magomed Ankalaev has been added to UFC Fight Night on Feb. 27. Fun fight. Ankalaev a potential dark horse in the division. Looking to add to a five-fight win streak.",1609287911,MMA
"Stephen Wonderboy Thompson-Hitting mits-Wrestles Chris Weidman ahead of Geoff Neal fight this weekend. Should be a good one, Neal is dangerous as they come. However he hasn’t fought for a year after a near death experience. Who you got?",1608159187,MMA
Post 256 UFC ranking updates,1608054731,MMA
AJ V Fury,1606520136,Boxing
Okolie vs Glowacki Off; Glowacki tests positive for COVID,1606993778,Boxing
Dana White hopes to book Jon Jones vs. Israel Adesanya in 2021,1608183714,MMA
"Brandon Moreno opens up about past departure from UFC, future in MMA",1607883729,MMA
What do you think I should do about girl in my gym continuing to spread rumors?,1608866394,MMA
"Spence: I'm On Verge Of Cleaning Out 147, I've Fought Better Foes Than Crawford",1607979504,Boxing
Deontay wilder has an underrated left hook,1610112748,Boxing
Boxers WHO SHOULD Be In The HALL OF FAME,1610578900,Boxing
Best 5 round wars,1609498182,MMA
Hello,1608566656,Boxing
"UFC Fighters Roast Fans | Paige VanZant, Rampage | Cameo Compilation | Fightful MMA",1608418115,MMA
Max Holloway vs. Calvin Kattar -- The Fight Site Staff Predictions,1610636578,MMA
Found an old phone at my parents house that has a picture of me and Shane Carwin. He let me hold his belt! I remember he's a really cool guy and an absolute TANK of a human being.,1609032646,MMA
"Lopez says that Lomachenko is 'number two' in the Lightweight division, but won't give him a rematch because he already beat him by unanimous decision. Urgh",1610549615,Boxing
Tim Tszyu Takes On Boxing Quiz,1608318439,Boxing
Are their any HEAVY WEIGHTS who successfully went down in weight to win belts in different classes?,1608672109,Boxing
[SPOLER] Concerned about fighter mental health,1607838103,MMA
VR Boxing With Real Boxing Gloves,1607190065,Boxing
[SPOILER] Jake Paul vs. Nate Robinson,1606622908,Boxing
I would like some boxing advice.,1606682335,Boxing
UFC Fight Night: Mike Davis vs. Mason Jones added to Jan. 20 lineup,1609258806,MMA
Uncle Dana and his empty threats to pirating streams,1610545270,MMA
Mike Perry's son is born,1609974584,MMA
Please let this usher in an endless age of snoop dogg commentary.,1606628184,Boxing
Masvidal kicks himself off Twitter,1610263813,MMA
How many PPV buys does a Bud vs Spence Generate?,1609813213,Boxing
Beginners,1608145830,Boxing
BREAKING: Neil Magny vs. Michael Chiesa confirmed to headline January 20th,1609383856,MMA
Jorge Masvidal: “2021 #UnfinishedBusiness”,1608438370,MMA
Sean Brady vs Jake Mathews added to UFC 259.,1607803220,MMA
Apparently they left Geoff Neal fight after congestive heart failure,1608589558,MMA
"Dan Hooker admits possibility of fighting McGregor was a big reason he accepted Chandler fight: ""He's not lying when he's saying get the red panties out because it's going to change your life! As a fighter, you'll do anything for that fight.""",1609930713,MMA
Who will be Terence Crawford's next opponent?,1606263049,Boxing
^^Irish^^ Steven Ward vs Hafthor Bjornsson Live Stream,1610632558,MMA
Floyd Mayweather vs Logan Paul Promo,1608749282,Boxing
UFC 257 main card,1607830938,MMA
Interview with UFC legend Gray Maynard discussing his UFC years and his life now.,1610420197,MMA
[FIGHT THREAD] Billy Joe Saunders vs Martin Murray,1607103769,Boxing
test ignore pls,1608754635,Boxing
Nate Robinson’s trainer,1606624652,Boxing
Queensberry: Lyndon Arthur vs Anthony Yarde Predictions,1607167891,Boxing
In your eyes who was the best super middleweight BEFORE Canelo beat Callum Smith?,1608997553,Boxing
Hello everyone! I’m an 18 year old personal trainer and a soon to be professional boxer! I’m trying to build my profile on Instagram to help me with clientele in the long run! Could you all please take a minute of your time just to visit the link and give me a follow! Thank you all so much!😁🥊🔥,1607292103,Boxing
EA UFC 4 Throws Shade at Khabib,1608437388,MMA
"Road to ""Chocolatito"" Gonzalez vs ""Gallo"" Estrada 2-Roman Gonzalez vs Juan Kantun",1610051527,Boxing
"Does anyone have the elite fight club Tyron Woodley - the chosen one, video saved?",1608440909,MMA
Who are the best heavyweight prospects?,1607734128,Boxing
"Abel Sanchez says that only David Benavidez has the ability to defeat Canelo at 168, and talks about when Abel was sparring with triple G",1608674948,Boxing
"Olympic gold medalist boxer Claressa Shields signs multiyear deal to fight in MMA, sources say",1606792473,Boxing
Lol,1608127408,MMA
Do you think Kieran Conway can be up there with Anthony Fowler and Scott Fitzgerald ?,1607697516,Boxing
Georges St. P-hair,1608883487,MMA
"Povetkin: Whyte Likes To Talk A lot, Postponement Was Better For Him",1609776601,Boxing
White Belt MMA Interview #10: Sasha Palatnikov talks UFC 255 win against Louis Cosce,1608266115,MMA
Salvador Sanchez finishes off Wilfredo Gomez in the 8th round of 'The Battle of the Little Giants' 40 years ago.,1609785015,Boxing
How brutal was the KO on Robinson by Paul?,1606737061,Boxing
Why do americans hate Anthony Joshua so much?,1607881579,Boxing
Anybody Remember When Jemele Hill Asked If Jake Paul Was Racist For Knocking Out Nate Robinson?,1608238799,Boxing
Short Compilation highlights of Khabib Normagomedov. 🔥,1608280410,MMA
Khabib wins BBC Sports Personality of the Year in public vote.,1608251431,MMA
How do you guys cut weight at the gym,1608469758,MMA
Oliverira is an absolute beast,1607985728,MMA
Boxing fans are looking like clowns dismissing jake paul....,1608066893,Boxing
Rate this sparring,1608128065,Boxing
BJJ Fighter on Irwin Rivera Allegations,1610633641,MMA
"My thoughts on Jake Paul Vs Connor McGregor ,Dana White and Dillon Danni's.Feel free to check it out.sorry if this annoys you.",1608308650,MMA
"Chael Sonnen finishes his career like a G, eating Machida's knees for a highlight reel retirement",1608376203,MMA
Why is everybody now getting disgusted because they saw a good armbar attempt ?,1607866522,MMA
Butaev vs Chatwood Full Fight - Didn't know Butaev fought last month!,1610647205,Boxing
Poirier v Hooker,1609781142,MMA
Are there any websites where i can watch boxing for free?,1606990828,Boxing
Would a 150lb male and female be equal for an MMA fight?,1607724071,MMA
Best FEMALE Head Kick KO's of all time!,1609877889,Boxing
Gervonta Davis vs Teofimo Lopez,1608586934,Boxing
UFC anti-doping policy changes: Positive marijuana test no longer violation.,1610644145,MMA
Would you like to see a third Charlo vs Harrison?,1608183231,Boxing
UFC Fight Night: Karl Roberson vs. Dalcha Lungiambula Prediction,1608256759,MMA
[Megan Anderson] The face you make when your opponent doesn't have a 'set time frame' to reschedule your fight but wants to fight a YouTuber...,1608086645,MMA
UFC Vegas 17 Fight Night Picks!,1608239993,MMA
[OC] A brief explanation of the possible right leg injury Wonderboy suffered against Neal this past weekend,1608610207,MMA
New weight class between Cruiserweight and Heavyweight?,1607948601,Boxing
"James Vick books first matchup since parting ways with UFC, fights Andre Fialho at XMMA show on Jan. 30",1610585992,MMA
Australian WBO title eliminator is on very soon and you won't want to miss Paul Gallen v Mark Hunt,1608108335,Boxing
Interview with 'White Iron Mike Tyson',1607796080,MMA
Dana White: Justin Gaethje vs. Charles Oliveira ‘probably’ next,1609946212,MMA
Body was in electrical 😂,1606623936,Boxing
1 For British Fans (Joe Joyce V Frazer Clarke),1607717655,Boxing
McGregor is currently ranked #1 P4P on the official UFC rankings. This isn’t the first time this has happened in recent months...,1609111244,MMA
Fury shoots down Hearn's suggestion that he may attend AJ-Pulev bout.,1607553068,Boxing
Mike Perry gives an update on his injury: currently being stitched up by a doctor,1609766193,MMA
"Need some help real quick. Bought a UFC 256 autographed poster and i can’t recognize some of these signatures, i put a “?” over them. Can ya’ll help me identify them? Thanks!",1610169603,MMA
Chito Vera vs Sean O' Malley Highlights,1608573956,MMA
Nominees for World MMA Awards. How are Masvidal and Zhang Breakout Fighter of the Year Nominees?,1608506488,MMA
What are some MMA conspiracy theories that you find believable?,1609133992,MMA
เว็บ สล็อต บาคาร่า บอล ที่ฮิตที่สุดบริการ24โชโมง,1607245054,Boxing
Where can i buy gloves,1609749116,Boxing
Don't Believe his Lies...,1608936098,MMA
Real Stuff,1610466795,MMA
"My opinion on the Jake Paul Vs Connor McGregor ,Dana White and Dillon Danni's.Feel free to check it out .Sorry if this annoys you.",1608308755,Boxing
Something people aren’t taking notice of,1607835972,Boxing
Dana White on Spencer Fisher’s current health issues and brain trauma research.,1610555888,MMA
"Edwards vs Chimaev is off once again, Chimaev has contracted COVID-19; UFC looking to reschedule bout for Feb. 21 in Las Vegas",1608878945,MMA
Who deserved the victory for tonight's main event?,1606539523,Boxing
#Tarotreading #Aries #Zodiac Aries♈️YOUR LOVE LIFE ❤️(singles)❤️December 2020,1607942665,MMA
Pokimane is THICC,1606993676,Boxing
"December 26, 1908 - Jack Johnson vs Tommy Burns",1609028750,Boxing
"Buy Facebook Ads Accounts - USA,UK Old Facebook Accounts",1608056340,Boxing
Heavy bag boxing resulting in these cuts... any ideas how to stop getting them??,1606868790,Boxing
Famous pressure fighters dealing with pressure,1606789438,Boxing
USADA drug tests according to Jon Jones,1608928261,MMA
Ryan Garcia speaks about chasing your dreams and says he will turn Luke Campbell into Campbell soup,1608606691,Boxing
[Coppinger] Sources: Adrien Broner slated to return in February on Showtime. Few opponents being discussed. First bout since he was defeated by Manny Pacquiao in January 2019. Otto Wallin-Dominic Breazeale heavyweight scarp is the chief support,1609294720,Boxing
"Bradley: Spence Looking For Money With Canelo, No Intention of Fighting Crawford",1609439552,Boxing
"Edgar ""El Monstruo"" Berlanga: Once An Accident, Twice A Coincidence, 16x Makes A Monster",1607966965,Boxing
Fighter of the Year 2020,1608530037,MMA
Opinion on boxing gloves,1609387109,Boxing
mike tyson vs roy jones - TRILLER Live,1606613879,Boxing
Paul Gallen Vs Mark Hunt,1608067143,Boxing
Jan Blachowicz TKO's Dominick Reyes to become UFC Light Heavyweight champion,1609444059,MMA
Bec Rawlings doesn’t expect Paige VanZant to find success in BKFC: ‘She wouldn’t get out of the first round with me’,1608787945,MMA
Leon Edwards vs Khabig rebooked to March 13th per Ariel,1610546073,MMA
One of the all time great rounds produced by Diaz and Daley.,1610473868,MMA
RDA sweeps Donald Cerrone with a gorgeous Deep Half Guard sweep,1608515107,MMA
Does anyone know whatever happened to ‘Summer’ who was hired by Dana after she was fired from Best Buy? This was so long ago I know. But I wonder if she still works for the UFC and if she’s still doing security. Just curious.,1610132070,MMA
"BLTV ""Best boxer in the world?""",1608158191,Boxing
Fantasy fight - Jake Paul vs Saul “Canelo” Alvarez @180ibs,1610590405,Boxing
"Hey I just made a MMA YouTube Channel would very much appreciate it if you could subscribe and tell me what you think of the video, cheers x",1610151934,MMA
"[POST FIGHT THREAD] Kazuto Ioka vs Kosei Tanaka, Daigo Higa vs Yuki Kobayashi.",1609408525,Boxing
BEST KNOCKOUTS OF ALL TIME IN BOXING HISTORY,1610097937,Boxing
"Luke Campbell is looking sharp and better than ever in these sparring footage, Luke is coming back to the ring after more than a year out to fight the boxing prospect Ryan Garcia in the states on Saturday the 2nd of January",1609098097,Boxing
Francis Ngannou Pre-Fight Camp Episode 2,1610455296,MMA
Khamzat Chimaev contracts Covid-19 and fight against Leon Edwards on January 20 is postponed again (Report in Portuguese),1609257214,MMA
"Anthony Yarde on Twitter - ""Time to make some changes""",1607647820,Boxing
"If Wilder-Fury trilogy is forced, given the fact Fury has been outside of a ring for over a year which is bad if you relly on your skill to win, do you see that being a problem for Fury against one punch KO guy like Wilder?",1608229774,Boxing
[FIGHT THREAD] Sam Eggington vs Ashley Theophane &amp; live round-by-round coverage,1607708368,Boxing
ERROL SPENCE VS DANNY GARCIA BREAKDOWN AND PREDICTION | SAUNDERS VS MURRAY | YARDE VS ARTHUR,1607195547,Boxing
2015 - Floyd Mayweather Jr vs Gennady Golovkin (155lb catchweight),1609907523,Boxing
Jake Paul's Walkout,1606795666,Boxing
"Best prospects apart from Gane, Fiziev, Chimaev, Ankalaev?",1609666889,MMA
Training parter,1608323879,Boxing
Why does it seem that Judges are way more incompetent in boxing than in the UFC?,1609608809,Boxing
"I’ve been watching the UFC since probably 2005, consistently for like the last 8 years. 2020 has been the best year of fights I’ve ever seen.",1608046468,MMA
Meticore Weight Loss Supplement,1609951984,Boxing
Rest of the lightweights next matchups?,1610262692,Boxing
Talkin Fight: The Scoop with Bola Ray,1609900358,Boxing
Lennox Lewis,1608833510,Boxing
Dana White Launches Attack on Negative Media as Promised! (Bonus Footage Of Dana In October Leading To This),1608824260,MMA
What is your crazy MMA conspiracy theory? One rule: It cant be serious.,1608127359,MMA
Talkin Fight: Weekly Episode | The Friday Night Panel,1610161163,Boxing
K-1 WORLD GP 2020 in Tokyo | All KO's &amp; Highlights from today!,1607956779,MMA
Olympic hopeful Charles Lolo Harris good sparring,1606347854,Boxing
Over a minute and a half of Weili Zhang vs Joanna Jędrzejczyk slowed down because it was so f*cking awesome from Connoisseur of Combat on Twitter,1607727000,MMA
I’m curious: How do people on this sub feel about Joe Rogan having people like Alex Jones and Gavin McInnis on his podcast knowing their ties to conspiracy theories and right wing extremism?,1608909705,MMA
Jake Paul vs Conor McGregor is 100% happening in 2021,1608388119,MMA
Marciano v Louis in color,1607550388,Boxing
How to see see boxing events for free,1607232136,Boxing
The Fight That Needs To Happen,1609445777,MMA
Guilottine counter,1608656401,MMA
Quick Question,1610581789,Boxing
Beterbiev at CW.,1606527286,Boxing
Jake Paul’s MMA chronicles,1608826266,MMA
